FullName,job_title,department,Company,org_type,Address,city,country,country_code,office_number,mobile_number,fax_number,Email,Website,updated_at
"Assoc. Prof. Bui Thanh Trang, Ph.D",Dean,School of International Business - Marketing,"University of Economics Ho Chi Minh City","59C Nguyen Dinh Chieu Street, Ward 6, Dist 3, HCMC, Vietnam",Ho Chi Minh City,Vietnam,trangbt@ueh.edu.vn,www.ueh.edu.vn,Education,VN,+84903362482,,,2025-08-30T00:51:44+08:00,Specialist/Academic,Vietnamese,Southeast Asia,Tier 2,Vietnam Education & Academia,"Explore academic partnerships or joint research in international business.",Bernadette
Alexandra Muñoz,Sales & Marketing Executive,,TablesChocolate,"Arcade 1, Amore at Portofino, Daang Hari, Almanza Dos, Las Piñas, Philippines",Las Piñas,Philippines,sales@tableschocolate.com,www.tableschocolate.com,Retail/F&B,PH,,+639985862686,,2025-08-30T00:51:44+08:00,Specialist/Academic,Filipino/Hispanic,Southeast Asia,Tier 3,Manila Retail & F&B,"Inquire about corporate gifting packages and partnerships.",Bernadette
Jaime P. Labor,President,,International School of Sustainable Tourism,"SUBIC BAY, Freeport Zone, 2222, Philippines",Subic Bay,Philippines,info@isstphilippines.edu.ph,www.isstphilippines.edu.ph,Education,PH,+6328342994,+639178143132,,2025-08-30T00:51:44+08:00,C-Level/Executive,Filipino/Hispanic,Southeast Asia,Tier 1,Manila Sustainable Tourism,"Propose a collaboration on sustainable tourism training and development.",Bernadette
"Fenny J. Dalimunthe, SE, M.Si",Wakil Direktur I Bidang Akademik,,Politeknik Pariwisata Medan,"Jl. Rumah Sakit Haji No. 12, Medan 20371, Indonesia",Medan,Indonesia,fenny_dalimunthe@yahoo.co.id,,Education,ID,+628126504504,,,2025-08-30T00:51:44+08:00,Specialist/Academic,Indonesian/Malay,Southeast Asia,Tier 2,Indonesia Tourism & Education,"Connect regarding academic curriculum development for tourism studies.",Bernadette
"Dr. Evi Ummi Kalsum, MA",Deputy Director for Tourism Human Resources Development,,Ministry of Tourism Republic of Indonesia,"Sapta Pesona Building, Jl. Medan Merdeka Barat No.17, Jakarta 10110, Indonesia",Jakarta,Indonesia,eukalsum@yahoo.com,,Government/Education,ID,+628129759754,,,2025-08-30T00:51:44+08:00,Senior Management,Indonesian/Malay,Southeast Asia,Tier 2,Indonesia Tourism & Government,"Inquire about national strategies for tourism human resource development.",Bernadette
Lawrence Luan,Chief Executive Officer,,Careers Connect,"22 Sin Ming Lane #06-76 Midview City, Singapore 573969",Singapore,Singapore,lawrence.luan@careersconnect.com.sg,www.careersconnect.com.sg,HR/Recruitment,SG,+6598289977,,,2025-08-30T00:51:44+08:00,C-Level/Executive,Chinese,Southeast Asia,Tier 1,Singapore HR & Recruitment,"Explore partnerships for talent acquisition and career development programs.",Bernadette
"St. Aminah Ab, S.E., M.Si",Lecturer,,Politeknik Pariwisata Makassar,"Jl. G. Rinjani Kota Mandiri Tanjung Bunga, Makassar, Indonesia",Makassar,Indonesia,st.aminah@poltekpar-makassar.ac.id,,Education,ID,+6285399559371,,,2025-08-30T00:51:44+08:00,Specialist/Academic,Indonesian/Malay,Southeast Asia,Tier 3,Indonesia Tourism & Education,"Discuss academic trends in the Indonesian tourism sector.",Bernadette
"TS. Ngô Quang Huân",Trưởng Bộ Môn,,Trường Đại Học Kinh Tế TP. Hồ Chí Minh (UEH),"59C Nguyễn Đình Chiểu, P.6, Q.3, TP.HCM, Vietnam",Ho Chi Minh City,Vietnam,nqhuan@ueh.edu.vn,,Education,VN,,+84918251865,,2025-08-30T00:51:44+08:00,Specialist/Academic,Vietnamese,Southeast Asia,Tier 3,Vietnam Education & Academia,"Reach out to the department head for potential academic collaboration.",Bernadette
Sulaiman Shehdek,Country Manager,,Wonderful Indonesia Tourism Office,"111 Somerset Road #09-06, 111 Somerset, Singapore 238164",Singapore,Singapore,sulaiman.wonderful-indonesia.sg,www.indonesia.travel,Government,SG,+6593864611,,,2025-08-30T00:51:44+08:00,Senior Management,Mixed/Other,Southeast Asia,Tier 2,Singapore-Indonesia Tourism,"Discuss cross-border tourism promotion initiatives.",Bernadette
"Nguyen Duc Tri, Ph.D",,School of Tourism,University of Economics Ho Chi Minh City,"59C Nguyen Dinh Chieu Street, Ward 6, Dist 3, HCMC, Vietnam",Ho Chi Minh City,Vietnam,ndtri@ueh.edu.vn,,Education,VN,+84909382005,,,2025-08-30T00:51:44+08:00,Specialist/Academic,Vietnamese,Southeast Asia,Tier 3,Vietnam Education & Academia,"Connect regarding tourism research and curriculum in Vietnam.",Bernadette
Stewart Tu,Director of Leading,,The Ritz-Carlton, Millenia Singapore,"7 Raffles Avenue, Singapore 039799",Singapore,Singapore,stewart.tu@ritzcarlton.com,www.ritzcarlton.com,Hospitality,SG,+6564345288,,+6563378888,2025-08-30T00:51:44+08:00,Senior Management,Chinese,Southeast Asia,Tier 2,Singapore Hospitality,"Discuss premium hospitality services and potential corporate partnerships.",Bernadette
"Vo Thi Hong Le, Ph.D",Dean,Foreign Languages for Economics,University of Economics Ho Chi Minh City,"59C Nguyen Dinh Chieu Street, Ward 6, Dist 3, HCMC, Vietnam",Ho Chi Minh City,Vietnam,hongle@ueh.edu.vn,,Education,VN,+84903828004,,,2025-08-30T00:51:44+08:00,Specialist/Academic,Vietnamese,Southeast Asia,Tier 2,Vietnam Education & Academia,"Inquire about language programs relevant to business and economics.",Bernadette
Harry Soetrisno,S.E., M.Si.,Head of Marketing for Singapore & Malaysia,,Wonderful Indonesia,"Sapta Pesona Building, Jl. Medan Merdeka Barat No.17, Jakarta 10110, Indonesia",Jakarta,Indonesia,harry.soetrisno@indonesia.travel,,Government,ID,+628128076695,,,2025-08-30T00:51:44+08:00,Senior Management,Indonesian/Malay,Southeast Asia,Tier 2,Indonesia Tourism & Marketing,"Discuss joint marketing campaigns targeting the Singapore and Malaysia markets.",Bernadette
"Phan Van Hoa, Ph.D. Candidate",,International Business and Country Studies Institute (ILACS),University of Economics Ho Chi Minh City,"279 Nguyen Tri Phuong St., Ward 5, District 10, HCMC, Vietnam",Ho Chi Minh City,Vietnam,hoapv@ueh.edu.vn,www.ilacs.ueh.edu.vn,Education,VN,+84918129299,,,2025-08-30T00:51:44+08:00,Specialist/Academic,Vietnamese,Southeast Asia,Tier 3,Vietnam Education & Academia,"Connect to discuss current research in international business studies.",Bernadette
Vanghese George,Senior Operations Manager,,Pegasus Education Group Pte Ltd,"103 Beach Road, #19-01/02, Singapore 189704",Singapore,Singapore,v.george@vanderwoodgroup.com,www.pegasus.edu.sg,Education,SG,,+6582092429,,2025-08-30T00:51:44+08:00,Senior Management,Indian,Southeast Asia,Tier 2,Singapore Education & Corporate,"Explore opportunities for collaboration on educational operations and programs.",Bernadette
"Monica May R. Sta. Ana",Market Analyst,Asia & Pacific Division,Tourism Promotions Board (TPB) Philippines,"4/F, Legaspi Towers 300, Roxas Blvd., Manila 1004, Philippines",Manila,Philippines,monica_staana@tpb.gov.ph,www.tpb.gov.ph,Government,PH,+6325259318,,,2025-08-30T00:51:44+08:00,Specialist/Academic,Filipino/Hispanic,Southeast Asia,Tier 3,Manila Government & Tourism,"Follow up for market analysis and data on the Asia-Pacific tourism sector.",Bernadette
"Macaibay, Riza Marie S.",Senior Tourism Operations Officer,Department of Tourism - Region VII,Department of Tourism,"LDM Bldg., cor Legaspi and MJ Cuenco Sts., Cebu City, Philippines",Cebu City,Philippines,dot7@tourism.gov.ph,www.itsmorefuninthephilippines.com,Government,PH,+63324121980,+639177169645,+63322546650,2025-08-30T00:51:44+08:00,Management,Filipino/Hispanic,Southeast Asia,Tier 3,Cebu Tourism & Government,"Inquire about specific tourism operations and initiatives in Region VII.",Bernadette
Tommy Osmeña,Mayor,,Republic of the Philippines, Office of the Mayor,"Cebu City, Philippines",Cebu,Philippines,tommy_osmena@cebucity.gov.ph,www.cebucity.gov.ph,Government,PH,+63322556984,+639173216122,,2025-08-30T00:51:44+08:00,C-Level/Executive,Filipino/Hispanic,Southeast Asia,Tier 1,Cebu Tourism & Government,"Seek a meeting to discuss high-level city development and investment policies.",Bernadette
Catalino E. Chan III,Regional Director,Region VII,Department of Tourism,"Ground Flr, LDM Bldg, cor Legaspi and MJ Cuenco Sts., Cebu City, Philippines",Cebu City,Philippines,dotregion7@gmail.com,www.tourism.gov.ph,Government,PH,+63322542811,+639175078563,,2025-08-30T00:51:44+08:00,Senior Management,Filipino/Hispanic,Southeast Asia,Tier 2,Cebu Tourism & Government,"Schedule a meeting to discuss regional tourism strategies for Central Visayas.",Bernadette
Alma Rita R. Jimenez,Undersecretary,"Tourism Regulation, Coordination and Resource Generation",Department of Tourism,"2/F New DOT Building, 351 Sen. Gil Puyat Avenue, 1200 Makati City, Philippines",Makati City,Philippines,arjimenez.tourism@gmail.com,,Government,PH,+6328900172,,+6328900147,2025-08-30T00:51:44+08:00,C-Level/Executive,Filipino/Hispanic,Southeast Asia,Tier 1,Manila Government & Tourism,"Request a meeting to discuss national tourism policy and regulations.",Bernadette
"Myrna G. Doydora, Ph.D.",Dean,College of Commerce,University of San Jose-Recoletos,"Cebu City, Philippines",Cebu City,Philippines,doydora@usjr.edu.ph,,Education,PH,,+639228833900,,2025-08-30T00:51:44+08:00,Specialist/Academic,Filipino/Hispanic,Southeast Asia,Tier 2,"Cebu Education & Academia","Propose a partnership with the College of Commerce for student internships or events.",Bernadette
"Aida M. L. Eltanal, MBA",Dean,College of Information, Computer and Communications Technology,University of San Jose-Recoletos,"Cebu City, Philippines",Cebu City,Philippines,eltanal@usjr.edu.ph,www.usjr.edu.ph,Education,PH,,+639228387037,,2025-08-30T00:51:44+08:00,Specialist/Academic,Filipino/Hispanic,Southeast Asia,Tier 2,"Cebu Education & Academia","Explore collaboration on tech-related projects or recruitment from the IT college.",Bernadette
"Dr. Edgar R. Oleston, CPA",Dean,College of Business & Management,University of the Visayas,"Cebu City, Philippines",Cebu City,Philippines,edgaroleston@yahoo.com,,Education,PH,,+639209520937,,2025-08-30T00:51:44+08:00,Specialist/Academic,Filipino/Hispanic,Southeast Asia,Tier 2,"Cebu Education & Academia","Discuss potential collaborations with the business and management college.",Bernadette
"Edwin Jr. A. Laroco, MHRM",Dean,College of Arts and Sciences,University of San Jose-Recoletos,"Cebu City, Philippines",Cebu City,Philippines,junlaroco@usjr.edu.ph,www.usjr.edu.ph,Education,PH,,+639228243343,,2025-08-30T00:51:44+08:00,Specialist/Academic,Filipino/Hispanic,Southeast Asia,Tier 2,"Cebu Education & Academia","Connect regarding interdisciplinary projects or partnerships with the Arts and Sciences college.",Bernadette
"Dr. Erl Ummi Kalsum, MM Par., CHM",Deputy Director for Student Affairs,Ministry of Tourism, Bandung Institute of Tourism,"Jl. Dr. Setiabudhi No. 186, Bandung 40141, Jawa Barat, Indonesia",Bandung,Indonesia,puket3@stp-bandung.ac.id,,Education,ID,+62222011456,+628122010887,,2025-08-30T00:51:44+08:00,Specialist/Academic,Indonesian/Malay,Southeast Asia,Tier 2,Indonesia Tourism & Education,"Inquire about student affairs and potential exchange programs.",Bernadette
FullName,job_title,department,Company,Address,city,country,Email,Website,org_type,country_code,office_number,mobile_number,fax_number,updated_at,inferred_seniority,inferred_name_origin,inferred_region,inferred_contact_tier,network_cluster,suggested_next_action,tag
"Low Wai Man, Raymond",Officer,Business Development / Employment Service,HKTT Hong Kong Travel & Tourism Training Centre Ltd,"1/F, VTC Commercial Services Ctr, 120 VTC Ctr, 27 Wood Road, Wan Chai, Hong Kong",Wan Chai,Hong Kong,raymondlow@hkttt.com.hk,www.hkttt.com.hk,Education,HK,+85228932822,,+85228939112,2025-08-30T00:54:30+08:00,Management,Chinese,East Asia,Tier 3,Hong Kong Tourism & Education,"Inquire about employee training and development programs.",Bernadette
Wendy Ng,Marketing Services Manager,,Hong Kong Convention and Exhibition Centre,"1 Expo Drive, Wanchai, Hong Kong",Wan Chai,Hong Kong,wendy.ng@hkcec.com,www.hkcec.com,Events/Hospitality,HK,+85225828888,,+85225821111,2025-08-30T00:54:30+08:00,Management,Chinese,East Asia,Tier 3,Hong Kong MICE & Events,"Discuss potential for hosting large-scale corporate events.",Bernadette
Lucas Gougeon,Assistant Food & Beverage Manager,Beverage,Sofitel Singapore Sentosa Resort & Spa,"2 Bukit Manis Road, Sentosa, Singapore 099891",Singapore,Singapore,lucas.gougeon@sofitel.com,www.sofitel-singapore-sentosa.com,Hospitality,SG,+6567088339,+6592985227,+6567088383,2025-08-30T00:54:30+08:00,Management,European,Southeast Asia,Tier 3,Singapore Hospitality,"Connect regarding beverage supply or event partnership opportunities.",Bernadette
Amy Loh,Sales Manager,,Hotel Jen Tanglin Singapore,"1A Cuscaden Road, Singapore 249716",Singapore,Singapore,amy.loh@hoteljen.com,hoteljen.com/tanglin,Hospitality,SG,+6567382222,+6581614010,+6568314300,2025-08-30T00:54:30+08:00,Management,Chinese,Southeast Asia,Tier 3,Singapore Hospitality,"Inquire about corporate rates and group bookings.",Bernadette
Willie Chan,Executive Officer,School of Hotel & Tourism Management,The Hong Kong Polytechnic University,"17 Science Museum Road, TST East, Kowloon, Hong Kong",Kowloon,Hong Kong,willie.chan@polyu.edu.hk,shtm.polyu.edu.hk,Education,HK,+85234002180,,,2025-08-30T00:54:30+08:00,Management,Chinese,East Asia,Tier 3,Hong Kong Tourism & Education,"Explore academic collaboration or internship programs for students.",Bernadette
"Dr. Karen M. Fernandez",Vice President for Research and International Affairs / Dean of the College of Hotel, Restaurant, and Tourism Management,,Junnus Institute of Science and Technology,"82 Nunez Ave., City of Imus, Cavite, Philippines",Imus,Philippines,karenfernandez@junnus.edu.ph,www.jist.edu.ph,Education,PH,+63464719266,+639258343000,,2025-08-30T00:54:30+08:00,C-Level/Executive,Filipino/Hispanic,Southeast Asia,Tier 1,"Manila Education & Academia","Propose institutional partnership for research and international affairs.",Bernadette
Joseph Cho,Director of Talent & Culture,,Sofitel Singapore Sentosa Resort & Spa,"2 Bukit Manis Road, Sentosa, Singapore 099891",Singapore,Singapore,joseph.cho@sofitel.com,www.sofitel.com,Hospitality,SG,+6567088302,+6598793080,+6567088383,2025-08-30T00:54:30+08:00,Senior Management,Chinese,Southeast Asia,Tier 2,Singapore Hospitality,"Connect regarding HR strategies and talent development in the hospitality sector.",Bernadette
Dianne Yuen,Director of Sales,,Hotel Jen Tanglin Singapore,"1A Cuscaden Road, Singapore 249716",Singapore,Singapore,dianne.yuen@hoteljen.com,hoteljen.com/tanglin,Hospitality,SG,+6568314310,+6591151118,+6568314300,2025-08-30T00:54:30+08:00,Senior Management,Chinese,Southeast Asia,Tier 2,Singapore Hospitality,"Schedule a meeting to discuss sales strategies and corporate partnerships.",Bernadette
Maggie Yu,Senior Communications Executive,,Hong Kong Convention and Exhibition Centre,"1 Expo Drive, Wanchai, Hong Kong",Wan Chai,Hong Kong,maggieyu@hkcec.com,www.hkcec.com,Events/Hospitality,HK,+6525828888,,,2025-08-30T00:54:30+08:00,Management,Chinese,East Asia,Tier 3,Hong Kong MICE & Events,"Connect regarding PR and communication opportunities for events.",Bernadette
Ozbay Nimet,Talent & Culture Manager,,SO/ Singapore,"35 Robinson Road, Singapore 068876",Singapore,Singapore,ozbay.nimet@so-singapore.com,so-singapore.com,Hospitality,SG,+6567016800,+6581389486,,2025-08-30T00:54:30+08:00,Management,Turkish,Southeast Asia,Tier 3,Singapore Hospitality,"Discuss talent management and recruitment strategies.",Bernadette
Chie Fria Alejandro,Managing Director,,Brunphil Express (S) Pte Ltd,"304 Orchard Road #B2-83, Lucky Plaza, Singapore 238863",Singapore,Singapore,chiefria@brunphil.com,brunphil.com,Services,SG,+6567026705,,,2025-08-30T00:54:30+08:00,C-Level/Executive,Filipino/Hispanic,Southeast Asia,Tier 1,Singapore Corporate,"Explore opportunities for logistics and express delivery services.",Bernadette
Thin Thin Soe,Director of Sales,,Hotel Jen Tanglin Singapore,"1A Cuscaden Road, #02-01, Singapore 249716",Singapore,Singapore,thinthin.soe@hoteljen.com,hoteljen.com/tanglin,Hospitality,SG,+6567382222,+6583318202,+6568314300,2025-08-30T00:54:30+08:00,Senior Management,Burmese,Southeast Asia,Tier 2,Singapore Hospitality,"Follow up on high-level sales and partnership opportunities.",Bernadette
Katrin Seegert,Director of Rooms,,Sofitel Singapore Sentosa Resort & Spa,"2 Bukit Manis Road, Sentosa, Singapore 099891",Singapore,Singapore,katrin.seegert@sofitel.com,www.sofitel.com,Hospitality,SG,+6567088309,+6591053460,+6567088383,2025-08-30T00:54:30+08:00,Senior Management,European,Southeast Asia,Tier 2,Singapore Hospitality,"Discuss guest experience and rooms division operations strategies.",Bernadette
Alistair Ang Eng Chong,Principal,RVI Institute,RVi Institute (S) Pte Ltd,"11 Keng Cheow Street, #03-09/10, The Riverside Piazza, Singapore 059608",Singapore,Singapore,alistair.ang@rvi-institute.com,www.RVi-institute.com,Education,SG,+6562228556,+6596356005,,2025-08-30T00:54:30+08:00,C-Level/Executive,Chinese,Southeast Asia,Tier 1,Singapore Education & Academia,"Propose partnership for educational programs or corporate training.",Bernadette
Motoi Mori,Head of Strategic Partnerships, Japan,Booking.com (Singapore) Pte. Ltd.,"12 Marina Boulevard, #30-01, MBRC Tower 3, Singapore 018982",Singapore,Singapore,motoi.mori@booking.com,www.booking.com,Tech/Travel,SG,+6566033496,+6594224641,,2025-08-30T00:54:30+08:00,Senior Management,Japanese,Southeast Asia,Tier 2,Singapore Travel Tech,"Discuss strategic partnership opportunities for the Japanese market.",Bernadette
Jacky Cheng,General Manager,Advantage Plus - Greater China,Accor,"Level 15, Office Tower A, The Gateway, 22 Canton Road, Tsim Sha Tsui, Kowloon, Hong Kong",Kowloon,Hong Kong,jacky.cheng@advantageplus.com.au,,Hospitality,HK,+85239621515,+8613917094303,,2025-08-30T00:54:30+08:00,C-Level/Executive,Chinese,East Asia,Tier 1,Hong Kong Hospitality,"Explore collaboration opportunities for Accor's loyalty program in Greater China.",Bernadette
"Jose Marlouy C. Taboada",Videographer | Photographer,,Cebu Provincial Tourism Office,"2nd Floor, West Wing, Cebu Provincial Capitol Building, Cebu City 6000, Philippines",Cebu City,Philippines,tourismcebu@gmail.com,,Government,PH,+63328882532,+639983611071,+63328882530,2025-08-30T00:54:30+08:00,Specialist/Academic,Filipino/Hispanic,Southeast Asia,Tier 3,Cebu Tourism & Government,"Propose collaboration for tourism promotion through visual media.",Bernadette
Christine Toguchi,Managing Director,,Macrovision Network Pte Ltd,"51 Tras Street #03-01, Singapore 078990",Singapore,Singapore,christine@macrovisionnetwork.com,www.macrovisionnetwork.com,Corporate,SG,+6591858168,,,2025-08-30T00:54:30+08:00,C-Level/Executive,Japanese,Southeast Asia,Tier 1,Singapore Corporate,"Inquire about business development or strategic consulting services.",Bernadette
Jason Lim,General Manager,,Naumi Hotels, a member of Hind Group,"41 Seah Street, Singapore 188396",Singapore,Singapore,jason@naumihotels.com,www.naumihotels.com,Hospitality,SG,+6564036000,,+6563390082,2025-08-30T00:54:30+08:00,C-Level/Executive,Chinese,Southeast Asia,Tier 1,Singapore Hospitality,"Request a meeting to discuss high-level hotel management and partnership.",Bernadette
Sri Wahidah Masturi,Head of Sales & Marketing,,The Warehouse Hotel,"320 Havelock Road, Singapore 169628",Singapore,Singapore,wahidah.masturi@thewarehousehotel.com,unlistedcollection.com,Hospitality,SG,+6568280000,,,2025-08-30T00:54:30+08:00,Senior Management,Indonesian/Malay,Southeast Asia,Tier 2,Singapore Hospitality,"Connect to discuss sales and marketing strategies.",Bernadette
"Ma. Croche Gantalao",General Manager,,KPG Travels & Tours,"A.C. Cortes Avenue, Mandaue City, Cebu, Philippines",Mandaue City,Philippines,kpgtravelandtours@yahoo.com.ph,www.kpgtravelandtours.com,Travel & Tourism,PH,+63324220936,+639225456762,,2025-08-30T00:54:30+08:00,C-Level/Executive,Filipino/Hispanic,Southeast Asia,Tier 1,Cebu Hospitality & Tourism,"Propose partnership for corporate travel and tour packages.",Bernadette
Seokho Seo,ASEAN & G-CIS B2B Inbound Group,Travel & Leisure Department,Rakuten, Inc.,"4-12-3 Higashi-shinagawa, Shinagawa-ku, Tokyo 140-0002, Japan",Tokyo,Japan,seokho.seo@rakuten.com,travel.rakuten.co.jp/,Tech/Travel,JP,+815058171640,,,2025-08-30T00:54:30+08:00,Management,Korean,East Asia,Tier 3,"Japan Travel Tech (ASEAN focus)","Discuss B2B inbound travel opportunities for the ASEAN region.",Bernadette
"Jo-ann Castillo",Director of Sales,,Crimson Resort and Spa Mactan,"Seascapes Resort Town, Mactan Island, Cebu 6015, Philippines",Mactan,Philippines,mactan.dos@crimsonhotel.com,crimsonhotel.com,Hospitality,PH,+63324019999,+639989616107,,2025-08-30T00:54:30+08:00,Senior Management,Filipino/Hispanic,Southeast Asia,Tier 2,Cebu Hospitality & Tourism,"Schedule a call to discuss corporate sales and event partnerships.",Bernadette
Jeffrey Tan,Head of Sales (Asia Pacific),,Rykadan Hospitality Investments Pte Ltd,"137 Market Street, #08-01 Grace Global Raffles, Singapore 048943",Singapore,Singapore,jeffreytan@rykadan.com,rykadan.com,Investment/Real Estate,SG,+6568093710,,,2025-08-30T00:54:30+08:00,Senior Management,Chinese,Southeast Asia,Tier 2,Singapore Corporate & Finance,"Inquire about hospitality investment opportunities in the Asia Pacific region.",Bernadette
Ayesha Khanna,CEO,,Technology Quotient,"Singapore",Singapore,Singapore,ayesha@tek-quotient.com,,Tech/Consulting,SG,,+6591465794,,2025-08-30T00:54:30+08:00,C-Level/Executive,Indian,Southeast Asia,Tier 1,Singapore Tech,"Propose collaboration on AI and technology consulting projects.",Bernadette
Masato Ishihara,Global Business Owner,,IKYU Corporation,"Sumitomo Fudosan Akasaka Bldg 8F 3-3-3 Akasaka, Minato-ku, Tokyo 107-0052, Japan",Tokyo,Japan,ishihara@ikyu.com,http://www.ikyu.com/,Tech/Travel,JP,+81362290069,,,2025-08-30T00:54:30+08:00,C-Level/Executive,Japanese,East Asia,Tier 1,Japan Travel Tech,"Connect regarding global business development for the travel platform.",Bernadette
Lucas Peng,CEO,,IFH Asia Pacific,,,,lucas.peng@ifh-worldwide.com,,Corporate,SG,+6564384055,+8613852156325,,2025-08-30T00:54:30+08:00,C-Level/Executive,Chinese,Southeast Asia,Tier 1,Singapore Corporate & Finance,"Research IFH's business and propose a high-level strategic partnership.",Bernadette
Joanna Duan,E-commerce Marketing Director,Inbound & MICE Department,U-tour,"A5, 8/F, Hua Yang Guang Chang, No. 17A Bai Yang Shu Road, Chaoyang District, Beijing 100022",Beijing,China,duanjoanna@utourworld.com,www.utourworld.com,Travel & Tourism,CN,+861059478809,+8613910511870,,2025-08-30T00:54:30+08:00,Senior Management,Chinese,East Asia,Tier 2,"China Travel & MICE","Discuss e-commerce marketing strategies for inbound and MICE travel.",Bernadette
Graham Hills,Managing Director,,Wego Indonesia,"Menara Palma #10-01, Jalan HR Rasuna Said Blok X2 Kav 6, Kuningan, Jakarta 12950",Jakarta,Indonesia,graham@wego.com,www.wego.co.id,Tech/Travel,ID,+622157957405,+6281288990676,+622157957406,2025-08-30T00:54:30+08:00,C-Level/Executive,European,Southeast Asia,Tier 1,Jakarta Travel Tech,"Propose a partnership to integrate services with Wego's travel platform.",Bernadette
Jonathan Poh,Executive Director,Master Coach,Mindzcel Academy Pte Ltd,"Singapore",Singapore,Singapore,jonathan.poh@mindzcel.com,www.mindzcel.com,Consulting/Training,SG,,+6581186628,,2025-08-30T00:54:30+08:00,C-Level/Executive,Chinese,Southeast Asia,Tier 1,Singapore Corporate,"Inquire about executive coaching and corporate training programs.",Bernadette
Lisa Chua Puay Hoon,Senior Lecturer,Diploma in Tourism & Resort Management,Temasek Polytechnic,"21 Tampines Avenue 1, Singapore 529757",Singapore,Singapore,lisachua@tp.edu.sg,www.tp.edu.sg,Education,SG,+6567805840,,,2025-08-30T00:54:30+08:00,Specialist/Academic,Chinese,Southeast Asia,Tier 3,Singapore Education & Academia,"Discuss curriculum and internship opportunities for tourism students.",Bernadette
Andy Ho,Managing Director,,Andy Adventure,"Jl. Jendral Sudirman 346, Bandung, Indonesia",Bandung,Indonesia,andy@andyadventuretravel.co.id,andyadventuretravel.co.id,Travel & Tourism,ID,+62226076680,+6285720300081,,2025-08-30T00:54:30+08:00,C-Level/Executive,Chinese,Southeast Asia,Tier 1,Indonesia Tourism & Travel,"Explore partnership for adventure travel packages in Indonesia.",Bernadette
Cleoisa Arana,Tour Care Live, Special Projects,,Safe2Travel,,,,cleoisa.arana@safe2travel.com,www.safe2travel.com,Travel & Tourism,SG,+6568233108,,,2025-08-30T00:54:30+08:00,Specialist/Academic,Filipino/Hispanic,Southeast Asia,Tier 3,Singapore Travel & Tourism,"Inquire about specialized tour projects and collaborations.",Bernadette
Princess Danicah Canoza,Continuous Improvement Manager,,Holiday Inn Singapore Atrium,"317 Outram Road, Singapore 169075",Singapore,Singapore,danicah.canoza@ihg.com,www.holidayinn.com,Hospitality,SG,+6567317181,+6591380589,,2025-08-30T00:54:30+08:00,Management,Filipino/Hispanic,Southeast Asia,Tier 3,Singapore Hospitality,"Discuss operational improvement strategies for hotel services.",Bernadette
"陳麗玲 (Chen Li Ling), Ph.D.",Professor,National Kaohsiung University of Hospitality and Tourism,"No.1, Songhe Rd., Xiaogang Dist., Kaohsiung City 81271, Taiwan",Kaohsiung,Taiwan,chenliling@nkuht.edu.tw,www.nkuht.edu.tw,Education,TW,+88678060505,,,2025-08-30T00:54:30+08:00,Specialist/Academic,Chinese,East Asia,Tier 2,Taiwan Hospitality & Education,"Propose joint research or academic exchange in hospitality studies.",Bernadette
Cedric Metrat Depardon,Senior Lecturer,Centre for Transcultural Studies,Temasek Polytechnic,"21 Tampines Avenue 1, Singapore 529757",Singapore,Singapore,depardon@tp.edu.sg,www.tp.edu.sg,Education,SG,+6567805889,,,2025-08-30T00:54:30+08:00,Specialist/Academic,European,Southeast Asia,Tier 3,Singapore Education & Academia,"Connect to discuss transcultural studies and potential guest lectures.",Bernadette
