FullName,job_title,department,Company,org_type,Address,city,country,country_code,office_number,mobile_number,fax_number,Email,Website,updated_at
Alen Azis,General Manager,,Hotel Aryaduta Makassar,"Jl. Somba Opu No. 297, Makassar 90111, South Sulawesi, Indonesia",Makassar,Indonesia,gm.makassar@aryaduta.com,,Hospitality,ID,+62411870555,+62811870223,+62411870222,2025-08-30T01:03:07+08:00,C-Level/Executive,Indonesian/Malay,Southeast Asia,Tier 1,Indonesia Hospitality,"Propose a high-level meeting to discuss hotel management and collaborations.",Bernadette
Mohamad Ridwan,S.ST Par., M.Si.,Lecturer,,Kementerian Pariwisata, Sekolah Tinggi Pariwisata Bandung,"Jl. Dr. Setiabudhi 186 Bandung 40141, Indonesia",Bandung,Indonesia,muhammadridwan@hotmail.com,,Government/Education,ID,,,,2025-08-30T01:03:07+08:00,Specialist/Academic,Indonesian/Malay,Southeast Asia,Tier 3,Indonesia Tourism & Education,"Discuss tourism curriculum and potential research collaborations.",Bernadette
"Dr. H. Muhadjir Suni, M.Pd.",Director,,State Tourism Polytechnic of Makassar,"Jl. Metro Tanjung Bunga, Makassar, South Sulawesi, Indonesia",Makassar,Indonesia,muhadjirsuni.ms@gmail.com,,Education,ID,+6285255422000,,,2025-08-30T01:03:07+08:00,Senior Management,Indonesian/Malay,Southeast Asia,Tier 2,Indonesia Tourism & Education,"Connect with the director to discuss institutional partnerships.",Bernadette
Arthyanto Trismartanto,General Manager,,Hotel Aryaduta Makassar,"Jl. Somba Opu No. 297, Makassar 90111, South Sulawesi, Indonesia",Makassar,Indonesia,gm.makassar@aryaduta.com,,Hospitality,ID,+62411870555,+628122240537,+62411870222,2025-08-30T01:03:07+08:00,C-Level/Executive,Indonesian/Malay,Southeast Asia,Tier 1,Indonesia Hospitality,"Arrange a meeting to discuss hotel operations and strategic direction.",Bernadette
Tan Johnson,Singapore Tourism Board Licensed Tourist Guide,,,"Singapore",Singapore,Singapore,tanjohnson13@outlook.com,www.fluxurioustravelplanners.com,Travel & Tourism,SG,,+6593899737,,2025-08-30T01:03:07+08:00,Specialist/Academic,Chinese,Southeast Asia,Tier 3,Singapore Travel & Tourism,"Explore collaborations for premium or specialized guided tours in Singapore.",Bernadette
Aisyah Endah Palupi,Education and Culture Attaché,,Embassy of the Republic of Indonesia,"7 Chatsworth Road, Singapore 249761",Singapore,Singapore,aisyah.palupi@kemdikbud.go.id,www.indonesianembassy.sg,Government/Consulate,SG,+6567377422,,,2025-08-30T01:03:07+08:00,Senior Management,Indonesian/Malay,Southeast Asia,Tier 2,Singapore-Indonesia Diplomacy,"Discuss cultural and educational exchange programs between Singapore and Indonesia.",Bernadette
Anggiat Sinaga,General Manager,,Grand Clarion Hotel & Convention Makassar,"Jl. A.P. Pettarani No. 3, Makassar, Indonesia",Makassar,Indonesia,gm@grandclarionmakassar.com,www.grandclarionmakassar.com,Hospitality,ID,+62411833888,,,2025-08-30T01:03:07+08:00,C-Level/Executive,Indonesian/Malay,Southeast Asia,Tier 1,Indonesia Hospitality,"Propose a partnership for large-scale conventions and events.",Bernadette
Nur Qurnia Rifka,Director of Sales & Marketing,,Hotel Aryaduta Makassar,"Jl. Somba Opu No. 297, Makassar 90111, South Sulawesi, Indonesia",Makassar,Indonesia,dosm.makassar@aryaduta.com,www.aryaduta.com,Hospitality,ID,+62411870555,+628122240537,+62411870222,2025-08-30T01:03:07+08:00,Senior Management,Indonesian/Malay,Southeast Asia,Tier 2,Indonesia Hospitality,"Connect to discuss sales and marketing strategies for the hotel.",Bernadette
"Andy L. Pagaduan, Jr.",Market Specialist,International Promotions Department - ASEAN,Tourism Promotions Board (TPB) Philippines,"4/F, Legaspi Towers 300, Roxas Blvd, Manila, Philippines",Manila,Philippines,andy_pagaduan@tpb.gov.ph,www.itsmorefuninthephilippines.com,Government,PH,+6325259318,+639063943187,+6325256974,2025-08-30T01:03:07+08:00,Specialist/Academic,Filipino/Hispanic,Southeast Asia,Tier 3,Manila Government & Tourism,"Discuss tourism promotion strategies targeting the ASEAN market.",Bernadette
"Joselito V. Gregorio",Officer-in-Charge,TPB Office of the COO,Tourism Promotions Board (TPB) Philippines,"4/F, Legaspi Towers 300, Roxas Blvd, Manila 1004, Philippines",Manila,Philippines,joey_gregorio@tpb.gov.ph,www.itsmorefuninthephilippines.com,Government,PH,+6325259318,,,2025-08-30T01:03:07+08:00,Management,Filipino/Hispanic,Southeast Asia,Tier 2,Manila Government & Tourism,"Connect regarding operational matters and strategic initiatives at TPB.",Bernadette
Teresa Catiipay,Director of Banquet & Catering,,Marco Polo Plaza Cebu,"Cebu Veterans Drive, Nivel Hills, Apas, Cebu City, 6000, Philippines",Cebu City,Philippines,teresa.catiipay@marcopolohotels.com,www.marcopolohotels.com,Hospitality,PH,+63322531111,+639178248718,,2025-08-30T01:03:07+08:00,Senior Management,Filipino/Hispanic,Southeast Asia,Tier 2,Cebu Hospitality & Tourism,"Discuss partnerships for large-scale banquets and catering events.",Bernadette
Chan Herng Yang,Vice President,Strategic Planning,The Ascott Limited,"168 Robinson Road #30-01 Capital Tower, Singapore 068912",Singapore,Singapore,chan.herngyang@the-ascott.com,www.the-ascott.com,Hospitality,SG,+6567132888,,,2025-08-30T01:03:07+08:00,C-Level/Executive,Chinese,Southeast Asia,Tier 1,Singapore Hospitality,"Request a high-level meeting to discuss strategic planning and investment.",Bernadette
James A. Sy,Market Specialist,International Promotions Department,Tourism Promotions Board (TPB) Philippines,"4/F, Legaspi Towers 300, Roxas Blvd, Manila, Philippines",Manila,Philippines,jamessy@tpb.gov.ph,www.itsmorefuninthephilippines.com,Government,PH,+6325259318,+639063943187,+6325256974,2025-08-30T01:03:07+08:00,Specialist/Academic,Chinese,Southeast Asia,Tier 3,Manila Government & Tourism,"Inquire about specific international tourism promotion campaigns.",Bernadette
Made Wiranatha,PO External Destination Marketing,,Swiss Foundation for Technical Cooperation (Swisscontact),"SME & Coop Dev Office of Central Lombok, Kec. Mandalika-Udaya, Kab. Tana Toraja, Sulawesi Selatan, Indonesia",Central Lombok,Indonesia,made.wiranatha@swisscontact.org,,Non-Profit/Foundation,ID,+6242335443,+628113931303,,2025-08-30T01:03:07+08:00,Management,Indonesian/Malay,Southeast Asia,Tier 3,Indonesia Tourism & Development,"Discuss destination marketing initiatives and technical cooperation.",Bernadette
Kushel Hasbardi,Marketing Communications Manager,,Far East Management,"Orchard Parade Hotel, 1 Tanglin Road, Singapore 247905",Singapore,Singapore,kushelhasbardi@fareast.com.sg,www.fareast.com.sg,Hospitality,SG,+6568817968,+6590747088,,2025-08-30T01:03:07+08:00,Management,Indonesian/Malay,Southeast Asia,Tier 3,Singapore Hospitality,"Connect regarding marketing communications strategies and campaigns.",Bernadette
Gavathrie Dasanayake,Manager,,Let's Travels (Private) Limited,"4th Floor, Automobile Association Building, Sir Mohamed Macan Marker Mawatha, Colombo 03, Sri Lanka",Colombo,Sri Lanka,gava@letstravels.com,www.letstravels.com,Travel & Tourism,LK,+94112390562,+94777322322,+94112390563,2025-08-30T01:03:07+08:00,Management,Indian,South Asia,Tier 3,Sri Lanka Travel & Tourism,"Inquire about travel packages and partnerships in Sri Lanka.",Bernadette
Emmanuel A. Zapate,Tourism Operations Officer,International Promotions Department,Tourism Promotions Board (TPB) Philippines,"4/F, Legaspi Towers 300, Roxas Blvd, Manila, Philippines",Manila,Philippines,emmanuel_zapate@tpb.gov.ph,www.itsmorefuninthephilippines.com,Government,PH,+6325259318,,,2025-08-30T01:03:07+08:00,Management,Filipino/Hispanic,Southeast Asia,Tier 3,Manila Government & Tourism,"Discuss the operational aspects of international tourism promotions.",Bernadette
Walter Sng,Senior Learning & Development Manager,,The South Beach,"30 Beach Road, Singapore 189763",Singapore,Singapore,walter.sng@thesouthbeach-sb.com,www.thesouthbeach-sb.com,Hospitality,SG,+6568181933,+6568181888,+6568222620,2025-08-30T01:03:07+08:00,Management,Chinese,Southeast Asia,Tier 3,Singapore Hospitality,"Connect regarding staff learning and development programs.",Bernadette
"Ramon ""Jojo"" S. De Veyra, Jr.",Officer-in-Charge, North Asia Division,International Promotions Department,Tourism Promotions Board (TPB) Philippines,"4/F, Legaspi Towers 300, Roxas Blvd, Manila, Philippines",Manila,Philippines,jojo_deveyra@tpb.gov.ph,www.itsmorefuninthephilippines.com,Government,PH,+6325259318,,,2025-08-30T01:03:07+08:00,Management,Filipino/Hispanic,Southeast Asia,Tier 2,Manila Government & Tourism,"Discuss tourism promotion strategies for the North Asia market.",Bernadette
Gina Victorino,Business Director,,Sta. Isabela,,,"USF Worldwide Corporate Center, Shaw Blvd, Mandaluyong City",Mandaluyong,Philippines,ginavictorino@staisabela.com.ph,,Corporate,PH,+6326550303,+639189230548,,2025-08-30T01:03:07+08:00,Senior Management,Filipino/Hispanic,Southeast Asia,Tier 2,Manila Corporate,"Inquire about business development and corporate services.",Bernadette
Dr. Fatma Meawad,C/O Republic Polytechnic,,University of Glasgow Singapore,"9 Woodlands Avenue 9, Singapore 738964",Singapore,Singapore,Fatma.Meawad@glasgow.ac.uk,www.glasgow.ac.uk/singapore,Education,SG,+6569086167,+6581428853,,2025-08-30T01:03:07+08:00,Specialist/Academic,Middle Eastern,Southeast Asia,Tier 3,Singapore Education & Academia,"Discuss academic partnerships and research opportunities.",Bernadette
Lioba Mauch,Marketing Manager,,Koelnmesse Pte Ltd,"152 Beach Road, #25-05 Gateway East, Singapore 189721",Singapore,Singapore,l.mauch@koelnmesse.com.sg,www.koelnmesse.com.sg,Events/MICE,SG,+6565006700,,,2025-08-30T01:03:07+08:00,Management,European,Southeast Asia,Tier 3,Singapore MICE & Events,"Connect regarding marketing opportunities for trade fairs and exhibitions.",Bernadette
Luh Tuhi Wirak S.A. Par., M.Rech,Lecturer,,Ministry of Tourism and Creative Economy, Bali Tourism Institute,"Jl. Dharmawangsa, Kampial, Nusa Dua 80363, Bali, Indonesia",Nusa Dua,Indonesia,wiraksatyawan@yahoo.com,,Government/Education,ID,+62361774441,,,2025-08-30T01:03:07+08:00,Specialist/Academic,Indonesian/Malay,Southeast Asia,Tier 3,Bali Hospitality & Education,"Discuss tourism research and academic curriculum in Bali.",Bernadette
Edwin Leong,Client solutions architect,,SG Quality,"Singapore",Singapore,Singapore,edwin@sgquality.org,,Corporate/Consulting,SG,,+6596358288,,2025-08-30T01:03:07+08:00,Specialist/Academic,Chinese,Southeast Asia,Tier 3,Singapore Corporate,"Inquire about customized client solutions and consulting services.",Bernadette
Jeremy Ang,Head of Department,Pastoral Care,Nanyang Junior College,"128 Serangoon Ave 3, Singapore 556111",Singapore,Singapore,jeremy_ang_jc@schools.gov.sg,www.nanyangjc.moe.edu.sg,Education,SG,+6562841821,,,2025-08-30T01:03:07+08:00,Senior Management,Chinese,Southeast Asia,Tier 2,Singapore Education & Academia,"Discuss student welfare and pastoral care programs.",Bernadette
Saffar Muhammad Godam,Immigration Attache,,Embassy of the Republic of Indonesia,"7 Chatsworth Road, Singapore 249761",Singapore,Singapore,saffar.godam@kemlu.go.id,,Government/Consulate,ID,+6567377422,,,2025-08-30T01:03:07+08:00,Senior Management,Indonesian/Malay,Southeast Asia,Tier 2,Singapore-Indonesia Diplomacy,"Connect regarding immigration policies and consular affairs.",Bernadette
Adeline Woo,Director,Human Resources,SingEx Holdings Pte Ltd,"1 Expo Drive, #02-01, Singapore 486150",Singapore,Singapore,adeline@singex.com,www.singex.com,Events/MICE,SG,+6564032160,,,2025-08-30T01:03:07+08:00,Senior Management,Chinese,Southeast Asia,Tier 2,Singapore MICE & Events,"Discuss high-level HR strategy for the MICE industry.",Bernadette
Caroline Lim,Chief Executive Officer,,SG Quality,"Singapore",Singapore,Singapore,caroline@sgquality.org,,Corporate/Consulting,SG,+6561114188,+65915465731,,2025-08-30T01:03:07+08:00,C-Level/Executive,Chinese,Southeast Asia,Tier 1,Singapore Corporate,"Request a meeting to discuss high-level business strategy and quality consulting.",Bernadette
Benjamin Quick,Head of Department,Physical, Sports & Outdoor Education,Ministry of Education, Singapore,"1 North Buona Vista Drive, Singapore 138675",Singapore,Singapore,benjamin_quick@moe.gov.sg,,Government,SG,+6568485914,,,2025-08-30T01:03:07+08:00,Senior Management,European,Southeast Asia,Tier 2,Singapore Education & Government,"Discuss strategies and programs for physical and outdoor education.",Bernadette
Juliana Soh,Senior Manager,Continuing Education & Training,SHATEC,"21 Bukit Batok Street 22, Singapore 659589",Singapore,Singapore,julianasoh@shatec.sg,www.shatec.sg,Education,SG,+6564150500,,,2025-08-30T01:03:07+08:00,Senior Management,Chinese,Southeast Asia,Tier 2,Singapore Hospitality & Education,"Explore partnerships for continuing education and professional training.",Bernadette
Made Muliani,Asst DOSM,,MACA Villas & Spa Bali,"Jl. Lebak Sari, No. 7, Petitenget, Seminyak, Bali, Indonesia",Seminyak,Indonesia,adsm@macavillas.com,www.macavillas.com,Hospitality,ID,+623614735738,,,2025-08-30T01:03:07+08:00,Management,Indonesian/Malay,Southeast Asia,Tier 3,Bali Hospitality & Tourism,"Inquire about sales and marketing opportunities for the villas.",Bernadette
Kong Hwee Ling,Senior Director,International Development,SIM Global Education,"461 Clementi Road, Singapore 599491",Singapore,Singapore,konghl@sim.edu.sg,www.simge.edu.sg,Education,SG,+6562480852,,,2025-08-30T01:03:07+08:00,Senior Management,Chinese,Southeast Asia,Tier 2,Singapore Education & Academia,"Discuss international development and institutional partnerships.",Bernadette
Sue Leed,Head of Department,CIT Tourism, Hospitality and Events,Canberra Institute of Technology,"37 Constitution Avenue, GPO Box 826, Canberra ACT 2601, Australia",Canberra,Australia,sue.leed@cit.edu.au,,Education,AU,,,,2025-08-30T01:03:07+08:00,Senior Management,European,Oceania,Tier 2,Australia Hospitality & Education,"Connect regarding curriculum development and partnerships in tourism education.",Bernadette
Antonio Tong,General Manager,,Ang's Tour Inc.,"47 Sta. Monica St., San Isidro, Pasay City, Metro Manila, Philippines",Pasay City,Philippines,angstour@hotmail.com,www.angstourincbiz.com,Travel & Tourism,PH,+6328413667,,,2025-08-30T01:03:07+08:00,C-Level/Executive,Chinese,Southeast Asia,Tier 1,Manila Travel & Tourism,"Propose a strategic partnership for inbound tour operations.",Bernadette
Siggi Wikanth-Soebiantoro,Travel Consultant,,Cataka Transwisata,"Jl. Mekar IV/14, South Sulawesi, Indonesia",Makassar,Indonesia,info@catakatour.com,,Travel & Tourism,ID,,+628129660855,,2025-08-30T01:03:07+08:00,Specialist/Academic,Indonesian/Malay,Southeast Asia,Tier 3,Indonesia Tourism & Travel,"Inquire about customized travel packages and consulting services.",Bernadette
Amalia ""Aimee"" Petras,General Manager,,Oasis Travel & Tours, Co.,"Unit 508, Burke Building, Burke St. corner Escolta, Manila, Philippines",Manila,Philippines,oasistravel2006@gmail.com,www.oasistravelandtours.com,Travel & Tourism,PH,+6322474880,+639178970812,+6322474940,2025-08-30T01:03:07+08:00,C-Level/Executive,Filipino/Hispanic,Southeast Asia,Tier 1,Manila Travel & Tourism,"Discuss potential partnerships for travel and tour services.",Bernadette
Sky Lim,Assistant Human Resources Manager,,Millennium Hotels and Resorts,"390 Havelock Road, #02-01 King's Centre, Singapore 169662",Singapore,Singapore,sky.lim@millenniumhotels.com,www.millenniumhotels.com,Hospitality,SG,+6566648833,+6590064962,,2025-08-30T01:03:07+08:00,Management,Chinese,Southeast Asia,Tier 3,Singapore Hospitality,"Connect regarding recruitment and HR operations.",Bernadette
Lee Wan Ting,Director, Human Capital and Development Services,Pan Pacific Hotels Group,"7500B Beach Road, #03-301 The Plaza, Singapore 199592",Singapore,Singapore,lee.wanting@pphg.com,www.pphg.com,Hospitality,SG,+6568087999,,,2025-08-30T01:03:07+08:00,Senior Management,Chinese,Southeast Asia,Tier 2,Singapore Hospitality,"Discuss high-level strategies for human capital development.",Bernadette
Edward Malcolm,Director,,Generation-X Pte Ltd,"69 Ubi Road 1 #09-20 Oxley Bizhub, Singapore 408731",Singapore,Singapore,edward@goxevents.com,www.goxevents.com,Events/MICE,SG,+6567022728,,,2025-08-30T01:03:07+08:00,Senior Management,European,Southeast Asia,Tier 2,Singapore MICE & Events,"Explore partnership opportunities for event management and production.",Bernadette
Tan Bee Bee,Group HR Manager,,IndoChine Group,"47 Club St, Singapore 069424",Singapore,Singapore,beebee@indochine-group.com,,F&B,SG,+6563258529,,,2025-08-30T01:03:07+08:00,Management,Chinese,Southeast Asia,Tier 3,Singapore F&B,"Connect regarding HR management for the F&B group.",Bernadette
Captn Liew Chye Leong,Shoreside Excursion Manager Singapore,,Intercruises,"73 Bukit Timah Road, #03-01, Rex House, Singapore 229832",Singapore,Singapore,cl.liew@intercruises.com,www.intercruises.com,Travel & Tourism,SG,+6563306688,+6590707724,+6562201221,2025-08-30T01:03:07+08:00,Management,Chinese,Southeast Asia,Tier 3,Singapore Travel & Tourism,"Discuss management and logistics of shore excursion operations.",Bernadette
Houng Liying,Vice President,Human Resource,The Ascott Limited,"168 Robinson Road #30-01 Capital Tower, Singapore 068912",Singapore,Singapore,houng.liying@the-ascott.com,www.the-ascott.com,Hospitality,SG,+6567132888,,,2025-08-30T01:03:07+08:00,C-Level/Executive,Chinese,Southeast Asia,Tier 1,Singapore Hospitality,"Request a high-level meeting on HR strategy and talent management.",Bernadette
Martess Cuan,Managing Director,,Oasis Travel & Tours, Co.,"Unit 508, Burke Building, Burke St. corner Escolta, Manila, Philippines",Manila,Philippines,oasistravel2011@gmail.com,,Travel & Tourism,PH,+6322474880,+639228000472,+6322474940,2025-08-30T01:03:07+08:00,C-Level/Executive,Filipino/Hispanic,Southeast Asia,Tier 1,Manila Travel & Tourism,"Discuss strategic partnerships and business direction.",Bernadette
Chang Chee Hang Leon,Senior Manager, Green Science and Technology, Enterprise Development,Infocomm Development Authority of Singapore (IDA),"10 Pasir Panjang Road, #10-01 Mapletree Business City, Singapore 117438",Singapore,Singapore,leon_chang@ida.gov.sg,www.ida.gov.sg,Government/Tech,SG,+6562111526,,,2025-08-30T01:03:07+08:00,Senior Management,Chinese,Southeast Asia,Tier 2,Singapore Tech & Government,"Discuss enterprise development in the green science and technology sector.",Bernadette
Ignatius Chow,Group Training & Development Director,,HPL Hotels & Resorts,"50 Cuscaden Road, #08-01, HPL House, Singapore 249724",Singapore,Singapore,ignatiuschow@hplhotels.com,www.hplhotels.com,Hospitality,SG,+6567345250,,,2025-08-30T01:03:07+08:00,Senior Management,Chinese,Southeast Asia,Tier 2,Singapore Hospitality,"Connect regarding group-wide training and talent development programs.",Bernadette
David Hind,Head, School of Events, Tourism & Hospitality,Leeds Beckett University,"Carnegie Campus, Headingley, Leeds, LS6 3DN, United Kingdom",Leeds,United Kingdom,d.hind@leedsbeckett.ac.uk,www.leedsbeckett.ac.uk,Education,GB,+441138123452,,,2025-08-30T01:03:07+08:00,Senior Management,European,Europe,Tier 2,UK Hospitality & Education,"Propose international academic partnerships and student exchanges.",Bernadette
Rachel Tang (Ms),Assistant Manager,Strategy & Innovation Division,Infocomm Development Authority of Singapore (IDA),"10 Pasir Panjang Road, #10-01 Mapletree Business City, Singapore 117438",Singapore,Singapore,rachel_tang@ida.gov.sg,www.ida.gov.sg,Government/Tech,SG,+6562110888,,,2025-08-30T01:03:07+08:00,Management,Chinese,Southeast Asia,Tier 3,Singapore Tech & Government,"Discuss innovation strategies and projects within the tech sector.",Bernadette
Paul Pians,Learning & Organisation Development Manager,,Far East Organization,"39 Merchant Road #04-01, Riverside Point, Singapore 058282",Singapore,Singapore,paulpians@fareast.com.sg,www.fareast.com.sg,Real Estate,SG,+6562352411,,,2025-08-30T01:03:07+08:00,Management,Indonesian/Malay,Southeast Asia,Tier 3,Singapore Corporate,"Inquire about corporate training and organizational development programs.",Bernadette
Putu Sariasih,DOSM,,MACA Villas & Spa Bali,"Jl. Lebak Sari, No. 7, Petitenget, Seminyak, Bali 80117, Indonesia",Seminyak,Indonesia,dosm@macavillas.com,www.macavillas.com,Hospitality,ID,+633614735738,+6281805561912,,2025-08-30T01:03:07+08:00,Senior Management,Indonesian/Malay,Southeast Asia,Tier 2,Bali Hospitality & Tourism,"Connect with the Director of Sales & Marketing to discuss partnerships.",Bernadette
张育青 (Teo Cherng Yuke),Assistant Chief Executive Officer,,International Enterprise Singapore,"230 Victoria Street #10-00, Bugis Junction Office Tower, Singapore 188024",Singapore,Singapore,teo_cherng_yuke@iesingapore.gov.sg,,Government,SG,+6563376628,,,2025-08-30T01:03:07+08:00,C-Level/Executive,Chinese,Southeast Asia,Tier 1,Singapore Government & Trade,"Request a high-level meeting to discuss international business strategies.",Bernadette
Doreen Tan,Manager, Administration & HR,Spectrum Worldwide Events (Singapore) Pte. Ltd.,"221 Henderson Road, #01-02 Henderson Building, Singapore 159557",Singapore,Singapore,dtan@spectrumworldwide.com.sg,www.spectrumworldwide.com.sg,Events/MICE,SG,+6567995905,,,2025-08-30T01:03:07+08:00,Management,Chinese,Southeast Asia,Tier 3,Singapore MICE & Events,"Connect regarding HR and administration for event management.",Bernadette
曹云清 (Shaw Wan Ching),Regional Director,East China,International Enterprise Singapore,"#15-01, Units 06-08, The Ascendas, 238 Victoria Street, Singapore 188023",Singapore,Singapore,shaw_wan_ching@iesingapore.gov.sg,,Government,SG,+6563376628,,,2025-08-30T01:03:07+08:00,Senior Management,Chinese,Southeast Asia,Tier 2,Singapore Government & Trade,"Discuss business opportunities and strategies for the East China market.",Bernadette
John Hamalian,Southeast Asia Representative,,Lean Global Network,"c/o 190 Middle Road #10-08, Singapore 188979",Singapore,Singapore,johnhamalian@leansea.org,leanglobal.org/affiliates,Consulting,SG,,+6581127914,,2025-08-30T01:03:07+08:00,Senior Management,Mixed/Other,Southeast Asia,Tier 2,Singapore Corporate,"Inquire about lean management consulting and training services.",Bernadette
洪讲宝 (Kenneth Sim),Deputy Director,Environment & Infrastructure Solutions,International Enterprise Singapore,"230 Victoria Street #10-00, Bugis Junction Office Tower, Singapore 188024",Singapore,Singapore,kenneth_sim@iesingapore.gov.sg,,Government,SG,+6563376628,,,2025-08-30T01:03:07+08:00,Senior Management,Chinese,Southeast Asia,Tier 2,Singapore Government & Infrastructure,"Discuss opportunities in the environment and infrastructure solutions sector.",Bernadette
"Dr. Marimin, M.Si.",Lecturer,,Ministry of Tourism Republic of Indonesia, Bandung Institute of Tourism,"Jl. Dr. Setiabudhi 186, Bandung 40141, West Java, Indonesia",Bandung,Indonesia,marimin@stp-bandung.ac.id,,Government/Education,ID,+62222011456,+6281322798604,,2025-08-30T01:03:07+08:00,Specialist/Academic,Indonesian/Malay,Southeast Asia,Tier 3,Indonesia Tourism & Education,"Connect regarding academic research and tourism studies.",Bernadette
R. Ida Bagus Putra Damayasa,Director of Sales & Marketing,,Kayu Raja Villa,"Jl. Lebak Sari 18, Petitenget, Krobokan Kelod, Kuta - Utara, Bali",Kuta,Indonesia,dosm@kayurajavilla.com,www.cillakayuraja.com,Hospitality,ID,+623614733776,+6281999657849,,2025-08-30T01:03:07+08:00,Senior Management,Indonesian/Malay,Southeast Asia,Tier 2,Bali Hospitality & Tourism,"Discuss sales and marketing partnerships for the villa.",Bernadette
Dhaniel Shamudra,Learning & Development Manager,,Grand Hyatt Bali,"Kawasan Wisata Nusa Dua BTDC, Nusa Dua, Bali, Indonesia 80363",Nusa Dua,Indonesia,dhaniel.shamudra@hyatt.com,bali.grand.hyatt.com,Hospitality,ID,+62361771234,,,2025-08-30T01:03:07+08:00,Management,Indonesian/Malay,Southeast Asia,Tier 3,Bali Hospitality & Education,"Inquire about staff training and learning & development programs.",Bernadette
Charlene Tan,Assistant Manager,Human Resources,SingEx Holdings Pte Ltd,"1 Expo Drive, #02-01, Singapore 486150",Singapore,Singapore,charlene.tan@singex.com,www.singex.com,Events/MICE,SG,+6564032100,+6598379118,,2025-08-30T01:03:07+08:00,Management,Chinese,Southeast Asia,Tier 3,Singapore MICE & Events,"Connect regarding HR and recruitment for the MICE industry.",Bernadette
Suryaningrat Wirawanto,Learning & Development Manager,,Conrad Bali,"Jalan Pratama 168, Tanjung Benoa, Bali 80363, Indonesia",Tanjung Benoa,Indonesia,suryaningrat.wirawanto@conradhotels.com,,Hospitality,ID,,+628123782782,,2025-08-30T01:03:07+08:00,Management,Indonesian/Malay,Southeast Asia,Tier 3,Bali Hospitality & Education,"Discuss learning and development initiatives for hospitality staff.",Bernadette
I Wayan Wiratama,General Manager,,Amadea Resort & Villas,"Jl. Laksmana 55, Seminyak, Bali, Indonesia",Seminyak,Indonesia,gm@amadeabali.com,www.amadeabali.com,Hospitality,ID,+623618478155,,,2025-08-30T01:03:07+08:00,C-Level/Executive,Indonesian/Malay,Southeast Asia,Tier 1,Bali Hospitality & Tourism,"Request a meeting to discuss high-level management and partnerships.",Bernadette
Faber Hutagaol,Revenue Center Manager,,Inaya Putri Bali,"Kawasan Wisata Nusa Dua Lot S-3, Nusa Dua, Bali, Indonesia",Nusa Dua,Indonesia,faber.hutagaol@inayaputribali.com,www.inayaputribali.com,Hospitality,ID,+62361771488,,,2025-08-30T01:03:07+08:00,Management,Indonesian/Malay,Southeast Asia,Tier 3,Bali Hospitality & Tourism,"Connect regarding revenue management and pricing strategies.",Bernadette
Anmay Samudra,Learning & Development Manager,,InterContinental Singapore,"80 Middle Road, Singapore 188966",Singapore,Singapore,anmay.samudra@ihg.com,singapore.intercontinental.com,Hospitality,SG,+6563387600,+6568251000,,2025-08-30T01:03:07+08:00,Management,Indian,Southeast Asia,Tier 3,Singapore Hospitality,"Discuss employee training and professional development programs.",Bernadette
