FullName,job_title,department,Company,org_type,Address,city,country,country_code,office_number,mobile_number,fax_number,Email,Website,updated_at
"Dr. Farid Said","Vice Director for Academic & Student Affairs",,"Ministry of Tourism - Tourism Polytechnic of Lombok","Polytechnic","Jl. Pemuda No. 59, Dasan Agung Baru, Selaparang, Mataram, Nusa Tenggara Barat","Mataram","Indonesia","ID",,"+628123700125",,,"dirpasparlpg2@gmail.com",,"2025-08-29T22:20:39+08:00"
"Wientor Rah Mada","Director",,"Ministry of Tourism - Bandung Institute of Tourism","Education","Jl. Dr. Setiabudhi 186 Bandung 40141","Bandung","Indonesia","ID",,"+62222011456",,"+6281809050009","+62222012822","direktur@stpb-bandung.ac.id","www.stpb-bandung.ac.id","2025-08-29T22:20:39+08:00"
"Dr. H. Hamzu Hanafi, MM","Director",,"Ministry of Tourism - Tourism Polytechnic of Lombok","Polytechnic","Jl. Pemuda No. 59, Dasan Agung Baru, Mataram","Mataram","Indonesia","ID",,,"+62811390499",,,"hamzuha@yahoo.com",,"2025-08-29T22:20:39+08:00"
"Aldo P. Siumorang","General Manager",,"Meliá Bandung Dago","Hotel & Casino","Jl. Gagak No. 102-104 Bandung","Bandung","Indonesia","ID","+62222501668",,"+62818981488",,"gm@meliabandung.com","www.melia.com","2025-08-29T22:20:39+08:00"
"Choo Teck Ming","Managing Director",,"IndoChine Group","F&B","47 Club St, Singapore 069424","Singapore","Singapore","SG","+6563258529",,"+6593212170",,"teckming@indochine-group.com","www.indochine-group.com","2025-08-29T22:20:39+08:00"
"Jonathan Poh","Executive Director & Master Coach",,"Mindszcel Academy Pte Ltd","Consulting",,,"Singapore","SG",,"+6581186628",,,"jonathanpoh@mindszcel.com","www.mindszcel.com","2025-08-29T22:20:39+08:00"
"Lisa Chua Puay Hoon, MBA","Senior Lecturer","Diploma in Tourism Management, School of Business","Temasek Polytechnic","Polytechnic","21 Tampines Avenue 1, Singapore 529757","Singapore","Singapore","SG","+6567805940",,,"lisachua@tp.edu.sg","www.tp.edu.sg","2025-08-29T22:20:39+08:00"
"Andy N","Managing Director",,"Adventure Travel","Travel Agency","Jl. Jendral Sudirman 548, Bandung, Indonesia","Bandung","Indonesia","ID","+62226078680",,"+6281220200083",,"andy@adventuretravel.co.id","adventuretravel.co.id","2025-08-29T22:20:39+08:00"
"Cleoisa Arana","Tour Executive, Special Projects",,"Safe2Travel","Travel Agency",,,"Singapore","SG","+6568233108",,,"cleoisaarana@safe2travel.com","www.safe2travel.com","2025-08-29T22:20:39+08:00"
"Princess Danicah Canoza","Continuous Improvement Manager",,"Holiday Inn Singapore Atrium","Hotel & Casino","317 Outram Road Singapore 169075","Singapore","Singapore","SG","+6567317183",,"+6596956799","+6567317383","princess.canoza@ihg.com","www.holidayinn.com","2025-08-29T22:20:39+08:00"
"Chen, Yi-Ling, Ph.D.","Director","Center for Taiwan-Philippines Indigenous Knowledge, Local Knowledge, and Sustainable Studies (CTPILS)","National Kaohsiung University of Hospitality and Tourism","Education","No.1, Songhe Rd., Xiaogang Dist., Kaohsiung City 81271, Taiwan","Kaohsiung City","Taiwan","TW","+88678060505",,,"chenyiling@mail.nkuht.edu.tw","www.nkuht.edu.tw","2025-08-29T22:20:39+08:00"
"Thin Thin Soe","Director of Sales",,"Hotel Jen Tanglin Singapore","Hotel & Casino","1A Cuscaden Road, Singapore 249716","Singapore","Singapore","SG","+6568314302",,"+6598587016",,"thinthin.soe@hoteljen.com","www.hoteljen.com/tanglin","2025-08-29T22:20:39+08:00"
"Cedric Metrat Depardon, MA, BA","Senior Lecturer","Centre for Transcultural Studies","Temasek Polytechnic","Polytechnic","21 Tampines Avenue 1, Singapore 529757","Singapore","Singapore","SG","+6567805128",,,"cedricm@tp.edu.sg","www.tp.edu.sg","2025-08-29T22:20:39+08:00"
"Jerome Jacquet","Manager","Academic Development, Centre for Transcultural Studies","Temasek Polytechnic","Polytechnic","21 Tampines Avenue 1, Singapore 529757","Singapore","Singapore","SG","+6567804090",,,"+6567833108","jacquet@tp.edu.sg","www.tp.edu.sg","2025-08-29T22:20:39+08:00"

FullName,job_title,department,Company,Address,city,country,Email,Website,org_type,country_code,office_number,mobile_number,fax_number,updated_at,inferred_seniority,inferred_name_origin,inferred_region,inferred_contact_tier,network_cluster,suggested_next_action,tag
"郭忠仕 (Guo Zhong Shi)",Chairman & General Manager,,KWOK GROUP LP,,,,,kwokcollection@gmail.com,www.kwokgroup.com,Corporate,SG,,+6591831088,,2025-08-30T00:51:44+08:00,C-Level/Executive,Chinese,Southeast Asia,Tier 1,Singapore Corporate,"Explore potential investment or partnership opportunities.",Bernadette
Ang Yoke Chong,Director of Rooms,,Millennium Hotels and Resorts,,,,,angchong.ang@millenniumhotels.com,www.millenniumhotels.com,Hospitality,SG,,+6591861068,,2025-08-30T00:51:44+08:00,Senior Management,Chinese,Southeast Asia,Tier 2,Singapore Hospitality,"Inquire about corporate rates or event hosting collaborations.",Bernadette
"Melanie B. De Ocampo, PhD",Asst. Dean,School of Business and Economics,University of San Carlos,"Downtown Campus, P. del Rosario St., Cebu City 6000, Philippines",Cebu City,Philippines,sbe.commerce@usc.edu.ph,www.usc.edu.ph,Education,PH,+63322531000,+639088803022,+63322554341,2025-08-30T00:51:44+08:00,Specialist/Academic,Filipino/Hispanic,Southeast Asia,Tier 2,"Cebu Education & Academia","Discuss potential internship programs for business students.",Bernadette
Hembler V. Mendoza,City Tourism Chief,Tourism Office,City of Lapu-Lapu,"M.L. Quezon National Highway, Pusok, Lapu-Lapu City, Cebu, Philippines",Lapu-Lapu City,Philippines,hemendoza_2011@yahoo.com,,Government,PH,+63322380882,+639178141132,+63322380882,2025-08-30T00:51:44+08:00,Senior Management,Filipino/Hispanic,Southeast Asia,Tier 1,Cebu Tourism & Government,"Schedule a meeting to discuss tourism initiatives in Lapu-Lapu City.",Bernadette
"Rodel M. Reyes, MMS",International and Local Exhibitions Officer,,University of San Jose-Recoletos,"Magallanes Street, 6000 Cebu City, Philippines",Cebu City,Philippines,rodel_reyes@usjr.edu.ph,www.usjr.edu.ph,Education,PH,+63322537900,+639233524613,,2025-08-30T00:51:44+08:00,Management,Filipino/Hispanic,Southeast Asia,Tier 3,"Cebu Education & Academia","Inquire about university participation in upcoming exhibitions or events.",Bernadette
"Agnes C. Sequiño, Ph.D.",Director,"Center for Policy, Research and Development Studies",University of San Jose - Recoletos,"Magallanes Street, 6000 Cebu City, Philippines",Cebu City,Philippines,agnes@usjr.edu.ph,www.usjr.edu.ph,Education,PH,+63322537900,+639228243344,,2025-08-30T00:51:44+08:00,Senior Management,Filipino/Hispanic,Southeast Asia,Tier 2,"Cebu Education & Academia","Propose a collaborative research project on regional development.",Bernadette
Marsianus Raga,,,Ministry of Tourism, Bandung Institute of Tourism,"Jl. Dr. Setiabudhi 186 Bandung 40141, West Java, Indonesia",Bandung,Indonesia,mapy-sony.com@yahoo.co.id,www.stp-bandung.ac.id,Government/Education,ID,+62222011456,,+62222012720,2025-08-30T00:51:44+08:00,Specialist/Academic,Indonesian/Malay,Southeast Asia,Tier 3,Indonesia Tourism & Education,"Connect regarding tourism education trends in Indonesia.",Bernadette
"Drs. Muhammad Arifin, M.Pd",Lecturer,,Tourism Polytechnic of Makassar,"Jl. Gunung Rinjani Kota Mandiri Tanjung Bunga, Makassar - South Sulawesi, Indonesia",Makassar,Indonesia,arifinmuhammad77@gmail.com,www.poltekpar-makassar.ac.id,Education,ID,+62411838438,+6281342923233,+62411838366,2025-08-30T00:51:44+08:00,Specialist/Academic,Indonesian/Malay,Southeast Asia,Tier 3,Indonesia Tourism & Education,"Inquire about guest lecturing opportunities or academic exchange.",Bernadette
Bernard Sebastian,,,Capri by Fraser,"NO 5 JALAN KERINCHI, BANGSAR SOUTH, 59200 KUALA LUMPUR, MALAYSIA",Kuala Lumpur,Malaysia,bernard.sebastian@capribyfraser.com,www.capribyfraser.com,Hospitality,MY,+60323860888,,+603989824,2025-08-30T00:51:44+08:00,Management,Mixed/Other,Southeast Asia,Tier 3,Kuala Lumpur Hospitality,"Reach out to discuss accommodation partnerships in Kuala Lumpur.",Bernadette
Karen Hassim,Marketing Communications Officer,,Waterfront Cebu City Hotel & Casino,"Salinas Drive, Lahug, Cebu City 6000, Philippines",Cebu City,Philippines,karen.hassim@waterfronthotels.net,www.waterfronthotels.com.ph,Hotel & Casino,PH,+63322326888,+639176332309,,2025-08-30T00:51:44+08:00,Management,Indonesian/Malay,Southeast Asia,Tier 3,Cebu Hospitality & Tourism,"Connect on LinkedIn and propose a marketing collaboration.",Bernadette
"Assoc. Prof. Giovanna V. Fontanilla",Director,Office of Public Affairs,"University of Santo Tomas, The Catholic University of the Philippines","Rm 102, Ground Floor, Main Building, UST, España, Manila, Philippines",Manila,Philippines,giovannavfontanilla58@yahoo.com,www.ust.edu.ph,Education,PH,+6327861611,,+6327409747,2025-08-30T00:51:44+08:00,Specialist/Academic,Filipino/Hispanic,Southeast Asia,Tier 2,Manila Education & Academia,"Reach out to discuss public relations strategies or university partnerships.",Bernadette
Gavin Png,Course Manager,"Diploma in Tourism & Resort Management, School of Business",Temasek Polytechnic,"21 Tampines Avenue 1, Singapore 529690",Singapore,Singapore,gavinpng@tp.edu.sg,www.tp.edu.sg,Education,SG,+6567805817,,+6567896175,2025-08-30T00:51:44+08:00,Management,Chinese,Southeast Asia,Tier 3,Singapore Education & Academia,"Explore curriculum collaboration for tourism management programs.",Bernadette
"Shyra Lou Martina E. Do-Jadulco","Group, Peer's Training & Dev't Manager",Peer's Resources Dev't. Department,Waterfront Hotels & Casino,"Salinas Drive, Lahug, Cebu City, Philippines",Cebu City,Philippines,shyra.dojadulco@waterfronthotels.net,www.waterfronthotels.com.ph,Hotel & Casino,PH,+63322326888,+639175218932,+63322326888,2025-08-30T00:51:44+08:00,Management,Filipino/Hispanic,Southeast Asia,Tier 3,Cebu Hospitality & Tourism,"Propose a joint training initiative or workshop for hospitality staff.",Bernadette
"Desmond Lim, M(SocSc)",Deputy Director,"Academic & Student Development, School of Business",Temasek Polytechnic,"21 Tampines Avenue 1, Singapore 529690",Singapore,Singapore,deslim@tp.edu.sg,www.tp.edu.sg,Education,SG,+6567806175,,+6567896175,2025-08-30T00:51:44+08:00,Senior Management,Chinese,Southeast Asia,Tier 2,Singapore Education & Academia,"Schedule a call to discuss student development programs and potential collaborations.",Bernadette
Rexlon T. Gatchalian,,,Waterfront Hotels & Casinos,"United Nations Avenue corner Ma. Orosa St., Manila 1000, Philippines",Manila,Philippines,rexlon.gatchalian@waterfronthotels.net,www.waterfronthotels.com.ph,Hotel & Casino,PH,+6325261212,+639178100308,+6325260129,2025-08-30T00:51:44+08:00,Management,Filipino/Hispanic,Southeast Asia,Tier 3,Manila Hospitality & Tourism,"Inquire about event hosting capabilities at their Manila property.",Bernadette
Grace Chia,Course Manager,"Diploma in Marketing, School of Business",Temasek Polytechnic,"21 Tampines Avenue 1, Singapore 529690",Singapore,Singapore,gmeichia@tp.edu.sg,www.tp.edu.sg,Education,SG,+6567805872,,+6567896175,2025-08-30T00:51:44+08:00,Management,Chinese,Southeast Asia,Tier 3,Singapore Education & Academia,"Share insights on marketing trends and explore guest lecture opportunities.",Bernadette
"Engr. Vincent B. Lazaro",Corporate Engineering Director,Engineering Department,Waterfront Cebu City Hotel & Casino,"Salinas Drive, Lahug, Cebu City 6000, Philippines",Cebu City,Philippines,vincent.lazaro@waterfronthotels.net,www.waterfronthotels.com.ph,Hotel & Casino,PH,+63322326888,+639177218575,,2025-08-30T00:51:44+08:00,Senior Management,Filipino/Hispanic,Southeast Asia,Tier 2,Cebu Hospitality & Tourism,"Connect regarding sustainable engineering practices in the hospitality industry.",Bernadette
"Teo Sze Cheng, MEd(Dist)",Director,"International Relations, Head, Centre for Transcultural Studies",Temasek Polytechnic,"21 Tampines Avenue 1, Singapore 529690",Singapore,Singapore,teoszche@tp.edu.sg,www.tp.edu.sg,Education,SG,+6567805331,,+6567897631,2025-08-30T00:51:44+08:00,Senior Management,Chinese,Southeast Asia,Tier 2,Singapore Education & Academia,"Inquire about international student exchange programs or transcultural studies partnerships.",Bernadette
Anders Hallden,General Manager,,Waterfront Cebu City Hotel & Casino,"Salinas Drive, Lahug, Cebu City 6000, Philippines",Cebu City,Philippines,anders.hallden@waterfronthotels.net,www.waterfronthotels.com.ph,Hotel & Casino,PH,+63322326888,+639985947748,+63322326880,2025-08-30T00:51:44+08:00,C-Level/Executive,European,Southeast Asia,Tier 1,Cebu Hospitality & Tourism,"Request a meeting to discuss high-level strategic partnerships.",Bernadette
"Jane Catherine O.",Sales Manager,,Golden JC Holiday Travel,"4/L ACC-SH11, AYALA Center, Cebu Business Park, Cebu City 6000, Philippines",Cebu City,Philippines,jane@goldenjctravel.com,,Travel & Tourism,PH,+63322328330,+639173218000,+63322328330,2025-08-30T00:51:44+08:00,Management,Chinese,Southeast Asia,Tier 3,Cebu Hospitality & Tourism,"Inquire about corporate travel packages and services.",Bernadette
Mechelle Stephanie Eguia,Sales Executive,,Shangri-La's Mactan Resort & Spa,"Punta Engaño Road, P.O. Box 86, Lapu-Lapu City 6015, Cebu, Philippines",Lapu-Lapu City,Philippines,mechelle.eguia@shangri-la.com,www.shangri-la.com,Hospitality,PH,+63322310288,,+63322311688,2025-08-30T00:51:44+08:00,Specialist/Academic,Filipino/Hispanic,Southeast Asia,Tier 3,Cebu Hospitality & Tourism,"Connect regarding group booking rates and resort amenities.",Bernadette
Alan G. Carvajal,Vice-President / General Manager,,Travelways International Incorporated,"68 F. Ramos Street, 6000 Cebu City, Philippines",Cebu City,Philippines,travelwaysinternational@yahoo.com,,Travel & Tourism,PH,+63322544105,+639173237106,+63322535607,2025-08-30T00:51:44+08:00,C-Level/Executive,Filipino/Hispanic,Southeast Asia,Tier 1,Cebu Hospitality & Tourism,"Propose a strategic partnership for travel and tour services.",Bernadette
Julie Najar,General Manager,,Marco Polo Plaza Cebu,"Cebu Veterans Drive, Nivel Hills, Apas, Cebu City 6000, Philippines",Cebu City,Philippines,julie.najar@marcopolohotels.com,www.marcopoloplazacebu.com,Hospitality,PH,+63322531111,+639209720283,+63322538910,2025-08-30T00:51:44+08:00,C-Level/Executive,Mixed/Other,Southeast Asia,Tier 1,Cebu Hospitality & Tourism,"Arrange a meeting to discuss executive-level collaborations or event partnerships.",Bernadette
Alice K. Queblatin,Managing Director,,Southwind Travel & Tours Inc.,"2nd Floor 2F Square Mall, Salinas Drive Lahug, Cebu City, Philippines",Cebu City,Philippines,alice@southwindtoursphilippines.com,www.southwindtoursphilippines.com,Travel & Tourism,PH,+63324128803,+639176230873,,2025-08-30T00:51:44+08:00,C-Level/Executive,Filipino/Hispanic,Southeast Asia,Tier 1,Cebu Hospitality & Tourism,"Follow up to explore partnership on inbound tour packages.",Bernadette
Suresh Pillay,Vice President of Operations,,Golden Prince Hotel & Suites,"Acacia St., cor. Archbishop Reyes Ave., Cebu City 6000, Philippines",Cebu City,Philippines,exec.op@goldenprincehotel.com,www.goldenprincehotel.com,Hospitality,PH,+63322301500,+639178198705,+63322301501,2025-08-30T00:51:44+08:00,C-Level/Executive,Indian,Southeast Asia,Tier 1,Cebu Hospitality & Tourism,"Connect to discuss operational excellence and potential strategic alliances.",Bernadette
"Jeane D. Sanches, FPM",General Manager,,Greatways Travel & Tours Inc.,"Unit 2 G/F MBDC Bldg., Mantawe Ave., Subangdaku, Mandaue City, Cebu, Philippines 6014",Mandaue City,Philippines,jeanesanches@greatwaystravellandtours.com,www.greatwaystravellandtours.com,Travel & Tourism,PH,+63323815854,+639228808479,,2025-08-30T00:51:44+08:00,C-Level/Executive,Filipino/Hispanic,Southeast Asia,Tier 1,Cebu Hospitality & Tourism,"Propose a joint marketing campaign for local and international tours.",Bernadette
Ma. Regina Moga II,Asst. Rooms Division Manager,,Golden Prince Hotel & Suites,"Acacia St., cor. Archbishop Reyes Ave., Cebu City 6000, Philippines",Cebu City,Philippines,rdmanager@goldenprincehotel.com,www.goldenprincehotel.com,Hospitality,PH,+63323182782,+639173054341,,2025-08-30T00:51:44+08:00,Management,Filipino/Hispanic,Southeast Asia,Tier 3,Cebu Hospitality & Tourism,"Follow up regarding room blocking and guest services for future events.",Bernadette
Mary Hyacinth A. Capacio-Saavedra,General Manager,,Greenline Travel Services,"G/F Cui Ene Coating Bldg., F. Ramos St., Cebu City, Philippines",Cebu City,Philippines,greenline_travel@yahoo.com,,Travel & Tourism,PH,+63322531559,+639176341945,+63322539891,2025-08-30T00:51:44+08:00,C-Level/Executive,Filipino/Hispanic,Southeast Asia,Tier 1,Cebu Hospitality & Tourism,"Discuss potential collaborations for travel services and tour packages.",Bernadette
"Fr. Felino B. Javines Jr., SVD, DM",Executive Committee,,Grace Foundation for Career Enhancement,"Cebu City, Philippines",Cebu City,Philippines,felinoceac@gmail.com,www.goldenprincehotel.com,Non-Profit/Foundation,PH,+63322301500,+639189812346,,2025-08-30T00:51:44+08:00,C-Level/Executive,Filipino/Hispanic,Southeast Asia,Tier 1,Cebu Education & Non-Profit,"Inquire about the foundation's mission and explore opportunities for partnership or support.",Bernadette
Warner M. Andrada,Chief Tourism Operations Officer,Product and Market Development Division,Department of Tourism,"DOT Building 351 Senator Gil Puyat Avenue, Makati City 1200, Philippines",Makati City,Philippines,wmandrada@tourism.gov.ph,www.itsmorefuninthephilippines.com,Government,PH,+6324595200,,+6328900574,2025-08-30T00:51:44+08:00,Senior Management,Filipino/Hispanic,Southeast Asia,Tier 2,Manila Government & Tourism,"Follow up on tourism market development programs and initiatives.",Bernadette
Agnes Almendras-Magpale,Vice Governor,Office of the Vice-Governor,"Republic of the Philippines, Province of Cebu","Cebu, Philippines",Cebu,Philippines,vicegov.magpale@cebu.gov.ph,,Government,PH,+63322548164,,+63322548164,2025-08-30T00:51:44+08:00,C-Level/Executive,Filipino/Hispanic,Southeast Asia,Tier 1,Cebu Tourism & Government,"Schedule a courtesy call to discuss provincial policies impacting tourism and business.",Bernadette
Stanley Lee,Director,Programmes & Partnership,Temasek Foundation CLG Limited,"1 Temasek Avenue #17-01 Millenia Tower, Singapore 039192",Singapore,Singapore,stanleylee@temasekfoundation.org.sg,www.temasekfoundation.org.sg,Non-Profit/Foundation,SG,+6568282599,,+6568282140,2025-08-30T00:51:44+08:00,Senior Management,Chinese,Southeast Asia,Tier 1,Singapore Corporate & Non-Profit,"Explore partnership opportunities for community and social programs.",Bernadette
Hon. Christopher R. Baricuatro,"Board Member, 7th District",Committee on Public Health and Social Services,"Republic of the Philippines, Province of Cebu","3rd Floor Legislative Building, Capitol Compound, Cebu City 6000, Philippines",Cebu City,Philippines,xtoffbaricuatro@gmail.com,,Government,PH,+63322538445,,,2025-08-30T00:51:44+08:00,C-Level/Executive,Filipino/Hispanic,Southeast Asia,Tier 1,Cebu Tourism & Government,"Discuss health and social service policies relevant to the local community and business environment.",Bernadette
"Asec. Daniel Ebarle Mercado","Asec., Tourism Regulation, Coordination and Resource Generation",,Department of Tourism,"351 Sen. Gil J. Puyat Ave., G/F DOT Bldg., 1200 Makati City, Philippines",Makati City,Philippines,dtebarlemercado@icloud.com,www.tourism.gov.ph,Government,PH,+6324595200,+639209588734,,2025-08-30T00:51:44+08:00,C-Level/Executive,Filipino/Hispanic,Southeast Asia,Tier 1,Manila Government & Tourism,"Request a high-level briefing on national tourism regulation and resource generation strategies.",Bernadette
Margot Osmeña,,,,,"Cebu, Philippines",Cebu,Philippines,,,,+639173272549,,2025-08-30T00:51:44+08:00,C-Level/Executive,Filipino/Hispanic,Southeast Asia,Tier 1,Cebu Tourism & Government,"Send an introductory text and request a convenient time for a brief call.",Bernadette
Hilario P. Davide III,Governor,,"Republic of the Philippines, Province of Cebu","Cebu Provincial Capitol, Cebu City 6000, Philippines",Cebu City,Philippines,,,,+63322383124,+639173270826,,2025-08-30T00:51:44+08:00,C-Level/Executive,Filipino/Hispanic,Southeast Asia,Tier 1,Cebu Tourism & Government,"Seek an audience to discuss investment and development opportunities in the province of Cebu.",Bernadette
"Ms. Dawnie B. Roa","Consultant, Tourism & Int'l. Affairs",Office of the Vice-Governor,"Republic of the Philippines, Province of Cebu","4th Floor, Legislative Bldg., Cebu City, Philippines",Cebu City,Philippines,dawneroal3@gmail.com,,Government,PH,+63322548164,,+63322548164,2025-08-30T00:51:44+08:00,Management,Filipino/Hispanic,Southeast Asia,Tier 2,Cebu Tourism & Government,"Connect to discuss specific tourism initiatives and international affairs policies.",Bernadette
Maria Rica C. Bueno,OIC Director,Office of Tourism Standards and Regulation,Department of Tourism,"351 Senator Gil Puyat Avenue, Makati City, Philippines",Makati City,Philippines,rcbueno@tourism.gov.ph,www.tourism.gov.ph,Government,PH,+6324595200,,+6328900147,2025-08-30T00:51:44+08:00,Senior Management,Filipino/Hispanic,Southeast Asia,Tier 2,Manila Government & Tourism,"Inquire about the latest standards and regulations for tourism enterprises.",Bernadette
"Judy Dela Cruz Gabato, MPA",Chief Tourism Operations Officer,Department of Tourism - Region VII,Department of Tourism,"G/F LDM Bldg., cor Legaspi and MJ Cuenco Sts., Cebu City, Philippines",Cebu City,Philippines,dot7@tourism.gov.ph,www.tourism.gov.ph,Government,PH,+63322542811,+639178545309,+63322542811,2025-08-30T00:51:44+08:00,Senior Management,Filipino/Hispanic,Southeast Asia,Tier 2,Cebu Tourism & Government,"Discuss regional tourism operations and development plans for Central Visayas.",Bernadette
Alexandra Muñoz,"Event Planning, Styling, Writing, Marketing",,Alexandra Muñoz,,,Cebu,Philippines,cebuevents@mac.com,,Consulting,PH,,+639177177742,,2025-08-30T00:51:44+08:00,Specialist/Academic,Filipino/Hispanic,Southeast Asia,Tier 3,Cebu Events & Marketing,"Propose collaboration on marketing for an upcoming event.",Bernadette
Sophie Secco,CEO,,Steam Evasion,,,,,e-sophie@steamevasion.com,www.steamevasion.com,Travel & Tourism,PH,,+639176313103,,2025-08-30T00:51:44+08:00,C-Level/Executive,Filipino/Hispanic,Southeast Asia,Tier 1,Cebu Travel Tech,"Inquire about their travel solutions for corporate clients.",Bernadette
Koh Xiuyan,Manager,"Training, Sourcing, Human Resources",KidZania Singapore,"31 Beach View #01-01/02, Singapore 098008",Singapore,Singapore,xiuyan.koh@kidzania.com.sg,www.kidzania.com.sg,Entertainment,SG,+6566536888,,+6566536899,2025-08-30T00:51:44+08:00,Management,Chinese,Southeast Asia,Tier 3,Singapore Entertainment & Attractions,"Discuss potential HR or training collaboration opportunities.",Bernadette
Edwin V. Ortiz,Director,Tourism Standards and Regulation,"Republic of the Philippines, Department of Tourism","T.M. Kalaw Street, Rizal Park, Manila, Philippines 1000",Manila,Philippines,edwinvortiz@yahoo.com,,Government,PH,+6325242131,+639173202737,,2025-08-30T00:51:44+08:00,Senior Management,Filipino/Hispanic,Southeast Asia,Tier 1,Manila Government & Tourism,"Follow up regarding national tourism standards and accreditation.",Bernadette
Eya Shrimski,,,,,,,,,+639173290077,,,2025-08-30T00:51:44+08:00,Management,Mixed/Other,Southeast Asia,Tier 3,Cebu Hospitality & Tourism,"Send an introductory text to establish context and purpose.",Bernadette
Leslie Chan,Lecturer,"Centre for Transcultural Studies, International Relations",Temasek Polytechnic,"21 Tampines Avenue 1, Singapore 529690",Singapore,Singapore,leslieyc@tp.edu.sg,www.tp.edu.sg,Education,SG,+6567805727,,,2025-08-30T00:51:44+08:00,Specialist/Academic,Chinese,Southeast Asia,Tier 3,Singapore Education & Academia,"Explore opportunities for a guest lecture on international relations.",Bernadette
Christine Luague,Sales Director,,Waterfront Cebu City Hotel & Casino,"Salinas Drive, Lahug, Cebu City 6000, Philippines",Cebu City,Philippines,christine.luague@waterfronthotels.net,www.waterfronthotels.com.ph,Hotel & Casino,PH,+63322326888,+639954988315,+63322326880,2025-08-30T00:51:44+08:00,Senior Management,Filipino/Hispanic,Southeast Asia,Tier 2,Cebu Hospitality & Tourism,"Discuss corporate event packages and long-term stay arrangements.",Bernadette
Aaron J Que,Executive Vice President,,Golden Prince Hotel & Suites,"Acacia St. cor. Archbishop Reyes Ave., Cebu City 6000, Philippines",Cebu City,Philippines,ajque@goldenprincehotel.com,www.goldenprincehotel.com,Hospitality,PH,,+639173104575,,2025-08-30T00:51:44+08:00,C-Level/Executive,Chinese,Southeast Asia,Tier 1,Cebu Hospitality & Tourism,"Request a meeting to discuss high-level strategic partnerships.",Bernadette
Maria Jane C. Paredes,Manager,Public Affairs,Smart Communications, Inc.,"Smart Tower 2, 6799 Ayala Avenue, Makati City, 1226, Philippines",Makati City,Philippines,mccparedes@smart.com.ph,www.smart.com.ph,Tech,PH,+6325116781,,,2025-08-30T00:51:44+08:00,Management,Filipino/Hispanic,Southeast Asia,Tier 3,Manila Corporate & Telecoms,"Connect regarding corporate social responsibility or public affairs initiatives.",Bernadette
Andrew Acquaah-Harrison,Chief Executive Advisor,,GMR Megawide Cebu Airport Corporation,"Airport Road, Lapu-Lapu City, Cebu 6016, Philippines",Lapu-Lapu City,Philippines,andrew.harrison@gmcac.ph,,Infrastructure,PH,+63324947000,,+63324947000,2025-08-30T00:51:44+08:00,C-Level/Executive,Mixed/Other,Southeast Asia,Tier 1,Cebu Infrastructure & Aviation,"Schedule a high-level meeting to discuss airport development and partnerships.",Bernadette
