FullName,job_title,department,Company,org_type,Address,city,country,country_code,office_number,mobile_number,fax_number,Email,Website,updated_at
"Melanie R. De Ocampo, PhD","Dean","School of Business and Economics","University of San Jose - Recoletos","Education","Basak Campus, Cebu City, 6000 Philippines","Cebu City","Philippines","PH","+63322311878",,,"sbe@usjr.edu.ph","www.usjr.edu.ph","2025-08-29T22:17:50+08:00"
"Hambali V. Mendoza","City Tourism Officer",,"City Government of Zamboanga","Government/Consulate","2/F City Hall, Zamboanga City 7000","Zamboanga City","Philippines","PH","+63629753292",,,"zcatourism@gmail.com",,"2025-08-29T22:17:50+08:00"
"Monica May R. Sta. Ana","OIC - Officer-In-Charge","Domestic Tourism Promotions Department","Tourism Promotions Board (TPB) Philippines","Government/Consulate","4th Floor, Legaspi Towers 300, Roxas Blvd., Manila, Philippines","Manila","Philippines","PH","+6325259318","+639178880613","+6325256142","monica_staana@tpb.gov.ph","www.thephilippines.travel","2025-08-29T22:17:50+08:00"
"Warner M. Andrada","OIC - Head","Product and Market Development - Planning","Department of Tourism","Government/Consulate","DOT Building, 351 Senator Gil Puyat Avenue, Makati City 1200 Philippines","Makati City","Philippines","PH","+6324595200","+639162910306",,"wmandrada@tourism.gov.ph","www.tourism.gov.ph","2025-08-29T22:17:50+08:00"
"Agnes Almendras-Magpale","Vice-Governor","Office of the Vice-Governor","Republic of the Philippines, Province of Cebu","Government/Consulate","Legislative Building, Capitol Compound, Cebu City","Cebu City","Philippines","PH","+63322531768",,"(032) 253-1768",,,"2025-08-29T22:17:50+08:00"
"Rodolfo P. Sages, MMS","Head","Admission and Student Affairs Office","University of San Jose-Recoletos","Education","Magallanes Street, Cebu City, 6000 Philippines","Cebu City","Philippines","PH","+63322537900",,,"sao@usjr.edu.ph","www.usjr.edu.ph","2025-08-29T22:17:50+08:00"
"Dr. Mohammad Ariff, Ph.D","Professor","Faculty of Business and Management","Universiti Teknologi MARA","Education","Puncak Alam Campus, 42300 Selangor, Malaysia","Selangor","Malaysia","MY","+60332587000","+60123932724",,"mohammadariff@puncakalam.uitm.edu.my",,"2025-08-29T22:17:50+08:00"
"Maznillay Riza Marie S.","Senior Tourism Officer / OIC",,"Department of Tourism - Region VIII","Government/Consulate","Ground Flr., Brgy. 25, Kanhuraw Hill, Magsaysay Blvd., cor. Senator Enage St., Tacloban City","Tacloban City","Philippines","PH","+63533212048",,,"dotreg8@yahoo.com; dot.region8@tourism.gov.ph","www.discovereasternvisayas.com","2025-08-29T22:17:50+08:00"
"Stanley Loh","President",,"Temasek Foundation","Government/Consulate","2 Temasek Avenue, #18-01, Centennial Tower, Singapore 039190","Singapore","Singapore","SG","+6568286008",,"+6568286007","stanleyloh@temasekfoundation.org.sg","www.temasekfoundation.org.sg","2025-08-29T22:17:50+08:00"
"Hon. Christopher P. Baricuatro","Board Member 7th District","Committee on Public Health and Social Services","Republic of the Philippines, Province of Cebu","Government/Consulate","Sangguniang Panlalawigan Office, Legislative Bldg., Capitol Cpd., Cebu City","Cebu City","Philippines","PH","+63322533392",,,"hon.christopher.baricuatro@cebu.gov.ph",,"2025-08-29T22:17:50+08:00"
"Agnes C. Sequitin, Ph.D.","Director","Center for Policy, Research and Development Studies","University of San Jose - Recoletos","Education","Magallanes Street, Cebu City, 6000 Philippines","Cebu City","Philippines","PH","+63322557449",,,"cprds.usjr@gmail.com",,"2025-08-29T22:17:50+08:00"
"Tonette H. Gica","Proprietress",,"Tom's Embroidery","F&B","168 Sikatuna St., Cebu City, Philippines","Cebu City","Philippines","PH","+63322536184","+639173210294",,"tonettegica@yahoo.com",,"2025-08-29T22:17:50+08:00"
"Daniel Ebarle Mercado","ASEC, OIC-Undersecretary","Tourism Regulation Coordination and Resource Generation","Department of Tourism","Government/Consulate","351 Sen. Gil J. Puyat Ave., Makati City","Makati City","Philippines","PH","+6324595200",,"_","demercado@tourism.gov.ph",,"2025-08-29T22:17:50+08:00"
"Margot Osmeña",,,,"",,,"Philippines","PH",,"_","+639173272549",,,,"2025-08-29T22:17:50+08:00"
"Catalino E. Chan III","Regional Director",,"Department of Tourism - Region VII","Government/Consulate","Ground Flr., LDM Bldg., cor. Legaspi St. cor. M.J. Cuenco St., Cebu City 6000 Philippines","Cebu City","Philippines","PH","+63322542811","+639275683492","+63322542811","dot7@yahoo.com; dotregion7@gmail.com","www.tourism.gov.ph; www.centralvisayas.com.ph","2025-08-29T22:17:50+08:00"
"Hilario P. Davide III","Governor","Office of the Governor","Republic of the Philippines, Province of Cebu","Government/Consulate","Cebu Provincial Capitol, Cebu City 6000 Philippines","Cebu City","Philippines","PH","+63322535628",,"+63322545021",,,"2025-08-29T22:17:50+08:00"
"Ms. Dawnie B. Roa","Consultant","Tourism & Heritage","Republic of the Philippines, Province of Cebu","Government/Consulate","Office of the Vice-Governor, Legislative Bldg, Capitol Compound, Cebu City 6000","Cebu City","Philippines","PH","+63322541849",,,"dawnie.roa@gmail.com",,"2025-08-29T22:17:50+08:00"
"Maryunus Raga","Staff",,"Ministry of Tourism, Republic of Indonesia","Government/Consulate","Sapta Pesona Building, Jl. Medan Merdeka Barat No.17, Jakarta 10110, Indonesia","Jakarta","Indonesia","ID","+62213838312",,"+62213454739","maryunus.raga@indonesia.travel","www.indonesia.travel","2025-08-29T22:17:50+08:00"
"Alma Rita R. Jimenez","Undersecretary","Tourism Regulation, Coordination, And Resource Generation","Department of Tourism","Government/Consulate","351 Sen. Gil Puyat Avenue, 1200 Makati City, Philippines","Makati City","Philippines","PH",,,"+6325217374","arjimenez@tourism.gov.ph","www.tourism.gov.ph","2025-08-29T22:17:50+08:00"
"Maria Rica C. Bueno","Director","Office of Tourism Standards and Regulation","Department of Tourism","Government/Consulate","351 Sen. Gil Puyat Avenue, Makati City 1200, Philippines","Makati City","Philippines","PH","+6324595200",,"+6325228185","rcbueno@tourism.gov.ph",,"2025-08-29T22:17:50+08:00"
"Judy Dela Cruz Gabato, MPA","Chief Tourism Operations Officer",,"Department of Tourism - Region VII","Government/Consulate","G/F LDM Bldg., Legaspi St. cor. MJ Cuenco Ave., Cebu City 6000","Cebu City","Philippines","PH","+63322546077",,"+63322542811","dot7@yahoo.com",,"2025-08-29T22:17:50+08:00"
"Dr. Edgar R. Olvina, CPA","Dean","College of Commerce","University of San Jose-Recoletos","Education","Basak Campus, Cebu City, 6000 Philippines","Cebu City","Philippines","PH","+63322617741",,,"commerce@usjr.edu.ph","www.usjr.edu.ph","2025-08-29T22:17:50+08:00"
"Jane Catherine O.","General Manager",,"Golden JC Holiday Travel","Travel Agency","Unit 11, ALA Condominium, J.L. Briones St., North Reclamation Area, Cebu City","Cebu City","Philippines","PH","+63324120077","+639173229071",,"goldenjc_holidaytravel@yahoo.com",,"2025-08-29T22:17:50+08:00"
"Michelle Stephanie Esguerra","Sales Manager",,"Shangri-La Mactan Resort and Spa","Hotel & Casino","Punta Engano Road, Lapu-Lapu City, Cebu, 6015, Philippines","Lapu-Lapu City","Philippines","PH","+63322310288","+639176232341",,"michelle.esguerra@shangri-la.com","www.shangri-la.com","2025-08-29T22:17:50+08:00"
"Assoc. Prof. Giovanna V. Fontanilla","Director","Office of Public Affairs","University of Santo Tomas","Education","G/F Main Building, UST, Espana Blvd., Sampaloc, Manila 1015 Philippines","Manila","Philippines","PH","+6327313544",,,"publicaffairs@ust.edu.ph","www.ust.edu.ph","2025-08-29T22:17:50+08:00"
"Erwin Png","Course Manager",,"Temasek Polytechnic","Polytechnic","21 Tampines Avenue 1, Singapore 529757","Singapore","Singapore","SG","+6567806100",,"+6567871867","erwinpng@tp.edu.sg","www.tp.edu.sg","2025-08-29T22:17:50+08:00"
"Harvey B. Itahid, MA-Devcom","Director","Student Affairs Office","University of San Jose-Recoletos","Education","Magallanes St., Cebu City, 6000, Philippines","Cebu City","Philippines","PH","+63322537900",,,"sao@usjr.edu.ph","www.usjr.edu.ph","2025-08-29T22:17:50+08:00"
"Alan G. Carvajal","Vice President - General Manager",,"Travelways International Incorporated","Travel Agency","6902, Ramos Street, Kamputhaw, Cebu City, Philippines","Cebu City","Philippines","PH","+63322534484",,,"alancarvajal_travelways@yahoo.com",,"2025-08-29T22:17:50+08:00"
"Julie Najar","General Manager",,"Marco Polo Plaza","Hotel & Casino","Cebu Veterans Drive, Nivel Hills, Apas, Cebu City 6000, Philippines","Cebu City","Philippines","PH","+63322531111",,,"gm.ceb@marcopolohotels.com","www.marcopoloplazacebu.com","2025-08-29T22:17:50+08:00"
"Sheena Lisa Martina E. Dea-Dailo","Rooms Division Manager",,"Waterfront Cebu City Hotel & Casino","Hotel & Casino","Salinas Drive, Lahug, Cebu City 6000, Philippines","Cebu City","Philippines","PH","+63322326888",,,"s.dea-dailo@waterfronthotels.net","www.waterfronthotels.com.ph","2025-08-29T22:17:50+08:00"
"Desmond Lim","Director","School of Business","Temasek Polytechnic","Polytechnic","21 Tampines Avenue 1, Singapore 529757","Singapore","Singapore","SG","+6567805129",,"+6567897331","desmond@tp.edu.sg","www.tp.edu.sg","2025-08-29T22:17:50+08:00"
"Ava Mella Remonde, MBA","Department Head","Allied Business Courses","University of San Jose-Recoletos","Education","College of Commerce, Basak Campus, Cebu City, 6000 Philippines","Cebu City","Philippines","PH",,,"_","ava.remonde@usjr.edu.ph",,"2025-08-29T22:17:50+08:00"
"Alice K. Queblatin","Managing Director",,"Southwind Travel & Tours","Travel Agency","Suite 504, Keppel Center, Cardinal Rosales Ave. cor. Samar Loop, Cebu Business Park, Cebu City","Cebu City","Philippines","PH","+63322323485",,,"alice@southwindtravelcebu.com",,"2025-08-29T22:17:50+08:00"
"Seresh Pilay","General Manager",,"Golden Prince Hotel & Suites","Hotel & Casino","Acacia Street cor. Archbishop Reyes Ave., Cebu City, 6000 Philippines","Cebu City","Philippines","PH","+63322301500","+639176228000","+63322301501","seresh.pilay@goldenprincehotel.com","www.goldenprincehotel.com","2025-08-29T22:17:50+08:00"
"Reuben T. Catchellar","Hotel Manager",,"Waterfront Hotels & Casinos","Hotel & Casino","1 Salinas Drive, Lahug, Cebu City, 6000, Philippines","Cebu City","Philippines","PH","+63322326888",,"+63322326880","r.catchellar@waterfronthotels.net","www.waterfronthotels.com.ph","2025-08-29T22:17:50+08:00"
"Chua Chia","Course Manager","Diploma in Culinary & Catering Management","Temasek Polytechnic","Polytechnic","21 Tampines Avenue 1, Singapore 529757","Singapore","Singapore","SG","+6567806599",,"+6567805932","chuachia@tp.edu.sg",,"2025-08-29T22:17:50+08:00"
"Myrla B. O. Gador-Jayagan, Phd-BA","Department Head","Dept. of Hospitality Mgt.","University of San Jose-Recoletos","Education","College of Commerce, Basak Campus, Cebu City","Cebu City","Philippines","PH","+63322617741",,,"myrla.jayagan@usjr.edu.ph",,"2025-08-29T22:17:50+08:00"
"Dr. Jessica D. Sanchis, RPh","General Manager",,"Cebu Centre for Travel & Tours Inc.","Travel Agency","Unit 212, Medalle Bldg., Osmena Blvd., Cebu City 6000","Cebu City","Philippines","PH","+63324168313",,"+63322543477","cebucentretravel@yahoo.com",,"2025-08-29T22:17:50+08:00"
"Regina Mogueis II","Sales & Marketing Manager",,"Golden Prince Hotel & Suites","Hotel & Casino","Acacia Street cor. Archbishop Reyes Ave., Cebu City 6000","Cebu City","Philippines","PH","+63322301588",,,"regina.mogueis@goldenprincehotel.com","www.goldenprincehotel.com","2025-08-29T22:17:50+08:00"
"Engr. Vincent B. Lazaro","Engineering Director",,"Waterfront Cebu City Hotel & Casino","Hotel & Casino","Salinas Drive, Lahug, Cebu City 6000, Philippines","Cebu City","Philippines","PH","+63322326888",,,"v.lazaro@waterfronthotels.net","www.waterfronthotels.com.ph","2025-08-29T22:17:50+08:00"
"Teo Sze Cheng","Director","School of Business","Temasek Polytechnic","Polytechnic","21 Tampines Avenue 1, Singapore 529757","Singapore","Singapore","SG","+6567805128",,,"szecheng@tp.edu.sg",,"2025-08-29T22:17:50+08:00"
"Edrick L. Templado, MBA-HRM","Chairperson","Department of Hospitality Management","University of San Carlos","Education","Department of Hospitality Management, Talamban, Cebu City 6000, Philippines","Cebu City","Philippines","PH","+63322300100",,,"eltemplado@usc.edu.ph",,"2025-08-29T22:17:50+08:00"
"Mary Hyacinth C. Capacio-Sareedra","General Manager",,"G Greenline Travel Services","Travel Agency","2/F Capitol Square, N. Escario St., Cebu City, 6000, Philippines","Cebu City","Philippines","PH","+63324129175",,,"greenlinetravel.cebu@gmail.com",,"2025-08-29T22:17:50+08:00"
"Fr. Felino E. Javines, Jr., SVD, DM","Founder / President",,"Grace Christian Mission","F&B","PO Box 297, Tacloban City 6500, Leyte, Philippines","Tacloban City","Philippines","PH","+63535009917","+639173217258",,"gracechristianmissionph@yahoo.com",,"2025-08-29T22:17:50+08:00"
"Anders Hallden","General Manager",,"Waterfront Airport Hotel and Casino Mactan","Hotel & Casino","1 Airport Road, Lapu-Lapu City, 6015 Cebu, Philippines","Lapu-Lapu City","Philippines","PH","+63323404888","+639989681886","+63323404888","a.hallden@waterfronthotels.net","www.waterfronthotels.com.ph","2025-08-29T22:17:50+08:00"
"Gevin Png","Course Manager","Diploma in Tourism Management, School of Business","Temasek Polytechnic","Polytechnic","21 Tampines Avenue 1, Singapore 529757","Singapore","Singapore","SG","+6567805817",,"+6567875817","gevinpng@tp.edu.sg","www.tp.edu.sg","2025-08-29T22:20:39+08:00"
"Shyrra Lou Martina E. Do-Jadulco","Group Peer's Training & Dev't. Manager","Peer's Resources Dept.","Waterfront Hotels & Casinos","Hotel & Casino","Salinas Drive, Lahug, Cebu City 6000 Philippines","Cebu City","Philippines","PH","+63322326888","+639177218557",,"s.dea-dailo@waterfronthotels.net","www.waterfronthotels.com.ph","2025-08-29T22:20:39+08:00"
"Rexlon T. Catchellar","Hotel Manager",,"Waterfront Hotels & Casinos - Manila Pavilion","Hotel & Casino","United Nations Avenue cor. Ma. Orosa St. Ermita, Manila 1000 Philippines","Manila","Philippines","PH","+6325261212","+639175690129","+6325262552","r.catchellar@waterfronthotels.net","www.waterfronthotels.com.ph","2025-08-29T22:20:39+08:00"
"Femmy J Dalimunthe, SE, M.Si","Wakil Direktur I Bidang Akademik",,"Politeknik Pariwisata Medan","Polytechnic","Jl. Rumah Sakit Haji No. 12, Medan 20371","Medan","Indonesia","ID","+62616644094",,,"femmy_dalimunthe@yahoo.co.id",,"2025-08-29T22:20:39+08:00"
"Dr. Eff. Ummi Kalsum, MA, CHE, CHM","Deputy Director for Student Affairs",,"Ministry of Tourism - Bandung Institute of Tourism","Education","Jl. Dr. Setiabudhi 186 Bandung 40141, West Java, Indonesia","Bandung","Indonesia","ID",,,"+628122049845",,"puket3@stpb-bandung.ac.id",,"2025-08-29T22:20:39+08:00"
"Lawrence Luan","Chief Executive Officer",,"Careers Connect","Consulting","22 Sin Ming Lane #06-76 Singapore 573969","Singapore","Singapore","SG","+6568839777",,,"lawrenceluan@careersconnect.com","www.careersconnect.com","2025-08-29T22:20:39+08:00"
"St. Aminah AB",,"",,"Politeknik Pariwisata Makassar","Polytechnic","Jl. Gunung Rinjani Kota Mandiri Tanjung Bunga, Makassar 90224","Makassar","Indonesia","ID","+62411888438","+6285395959971","+62411838366","staminah@poltekpar-makassar.ac.id","www.poltekpar-makassar.ac.id","2025-08-29T22:20:39+08:00"
"TS. NGO QUANG HUAN","Truong Khoa Quan tri",,"Truong Dai Hoc Kinh Te TP. Ho Chi Minh","Education","59C Nguyen Dinh Chieu, Ward 6, Dist 3, HCMC","Ho Chi Minh City","Vietnam","VN","+842838295299","+84918281665",,"nqhuan@ueh.edu.vn",,"2025-08-29T22:20:39+08:00"
"Sulaiman Shedek","Country Manager",,"Indonesia Tourism-Office SG","Government/Consulate","10 Eunos Road 8, #12-04A Singapore Post Centre, Singapore 408600","Singapore","Singapore","SG","+6564693801","+6593864611",,"shahdek@hotmail.com","www.tourism-indonesia.sg","2025-08-29T22:20:39+08:00"
"Nguyen Duc Tri, Ph.D","Dean","School of Tourism","University of Economics Ho Chi Minh City","Education","59C Nguyen Dinh Chieu, Ward 6, Dist 3, HCMC","Ho Chi Minh City","Vietnam","VN","+842838295299",,,"ndtri@ueh.edu.vn","www.ueh.edu.vn","2025-08-29T22:20:39+08:00"
"Stewart Tu","Director of Leading Quality Assurance",,"The Ritz-Carlton, Millenia Singapore","Hotel & Casino","7 Raffles Avenue, Singapore 039799","Singapore","Singapore","SG","+6564345088",,"+6564345087","stewart.tu@ritzcarlton.com","www.ritzcarlton.com","2025-08-29T22:20:39+08:00"
"Vo Thi Hong Le, Ph.D","Vice Dean","Foreign Languages for Economics","University of Economics Ho Chi Minh City","Education","59C Nguyen Dinh Chieu, Ward 6, Dist 3, HCMC","Ho Chi Minh City","Vietnam","VN","+842838295299",,,"levth@ueh.edu.vn","www.ueh.edu.vn","2025-08-29T22:20:39+08:00"
"Harry Soetrisno, S.E, M.Si.","Head of Sub Division for Promotion",,"Ministry of Tourism","Government/Consulate","Sapta Pesona Building, Jl. Medan Merdeka Barat No. 17, Jakarta 10110","Jakarta","Indonesia","ID",,"+6281310701181",,,"harrysoetrisno@gmail.com","www.indonesia.travel","2025-08-29T22:20:39+08:00"
"Phan Dinh Manh, Ph.D. Candidate","Lecturer","International Economics","University of Economics Ho Chi Minh City","Education","59C Nguyen Dinh Chieu, Ward 6, Dist 3, HCMC","Ho Chi Minh City","Vietnam","VN","+84838456635","+84918113797",,"pdmanh@ueh.edu.vn","www.ilacs.ueh.edu.vn","2025-08-29T22:20:39+08:00"
"Vanesha George","Senior Operations Manager",,"Pegasus Education Group Pte Ltd","Travel Agency","1003 Bukit Merah Central, #03-10, Singapore 159836","Singapore","Singapore","SG","+6562262429",,,"vanesha@pegasus-group.com.sg","www.pegasus-group.com.sg","2025-08-29T22:20:39+08:00"
"Alexandra Muñoz","Founder",,"Alexandra Muñoz Consulting","Consulting",,,"Philippines","PH",,"+639178978762",,"alexandramunozconsulting@gmail.com",,"2025-08-29T22:20:39+08:00"
"Sophie Secco",,,"Steam Evasion","Travel Agency",,,"Philippines","PH",,"+639176313103",,"sophie@steamevasion.com","www.steamevasion.com","2025-08-29T22:20:39+08:00"
"Koh Kiuyan","Asst. Manager","Training, Human Resources","KidZania Singapore","F&B","31 Beach View #01-01/02 Singapore 098008","Singapore","Singapore","SG","+6566531085",,"+6598335834",,"kiuyan.koh@kidzania.com.sg","www.kidzania.com.sg","2025-08-29T22:20:39+08:00"
"Edwin V. Ortiz","Director","Tourism Promotions Board","Republic of the Philippines","Government/Consulate","T.M. Kalaw Street, Rizal Park, Manila, Philippines 1000","Manila","Philippines","PH","+6325242131","+639173202727",,"edwincentouriz@yahoo.com",,"2025-08-29T22:20:39+08:00"
"Eya Shrimski",,,,"",,"Cebu","Philippines","PH",,"+639173290077",,"eya@shrimski.com.ph",,"2025-08-29T22:20:39+08:00"
"Leslie Chan, MBA","Lecturer","Centre for Transcultural Studies, International Relations","Temasek Polytechnic","Polytechnic","21 Tampines Avenue 1, Singapore 529757","Singapore","Singapore","SG","+6567805128",,,"lesliec@tp.edu.sg","www.tp.edu.sg","2025-08-29T22:20:39+08:00"
"Christine Luague","Sales Director",,"Waterfront Cebu City Hotel & Casino","Hotel & Casino","1 Salinas Drive Lahug, Cebu City, Philippines 6000","Cebu City","Philippines","PH","+63322326888","+639989681881","+63322326880","c.luague@waterfronthotels.net","www.waterfronthotels.com.ph","2025-08-29T22:20:39+08:00"
"Aaron J Que","Executive Vice President",,"Golden Prince Hotel & Suites","Hotel & Casino","Acacia St., cor. Archbishop Reyes Ave., Cebu City 6000","Cebu City","Philippines","PH","+63322301500","+639173104573",,"ajque@goldenprincehotel.com","www.goldenprincehotel.com","2025-08-29T22:20:39+08:00"
"Maria Jane C. Paredes","AVP / Head","Public Affairs","Smart Communications, Inc.","Tech","Smart Tower, 6799 Ayala Avenue, 1226 Makati City","Makati City","Philippines","PH",,"+6325116781",,"MJCparedes@smart.com.ph",,"2025-08-29T22:20:39+08:00"
"Andrew Acquaah-Harrison","Chief Executive Advisor",,"GMR Megawide Cebu Airport Corporation","Government/Consulate","GMCAC Corporate Offices, Airport Road, Lapu-lapu City, Cebu 6016","Lapu-Lapu City","Philippines","PH","+63324947000",,"+639173007140",,"andrew.harrison@gmcac.ph",,"2025-08-29T22:20:39+08:00"
"Assoc. Prof. Bui Thanh Trang, Ph.D","Dean","School of International Business - Marketing","University of Economics Ho Chi Minh City","Education","59C Nguyen Dinh Chieu, Ward 6, Dist 3, HCMC","Ho Chi Minh City","Vietnam","VN","+84903361492",,,"trangbtt@ueh.edu.vn","www.ueh.edu.vn","2025-08-29T22:20:39+08:00"
"Alexandra Muñoz","Sales & Marketing Executive",,"TablesChocolate","F&B","Ayala Center Cebu, The Terraces, Cebu City","Cebu City","Philippines","PH",,"+639985862266",,"sales@tableschocolate.com","www.tableschocolate.com","2025-08-29T22:20:39+08:00"
"Jaime J. Labor","President",,"International School of Sustainable Tourism","Education","G/F East Asiapect Bldg, Lot 3 Subic Bay Gateway Park, Subic Bay Freeport Zone, 2222","Subic Bay","Philippines","PH","+63472522944","+639178143132",,"info@isstphilippines.edu.ph","www.isstphilippines.edu.ph","2025-08-29T22:20:39+08:00"
"Motoi Mori","Head of Strategic Partnerships, Japan",,"Booking.com (Singapore) Pte. Ltd.","Travel Agency","12 Marina Boulevard, #30-01, MBFC Tower 3, Singapore 018982","Singapore","Singapore","SG","+6564228421",,,"motoi.mori@booking.com","www.booking.com","2025-08-29T22:20:39+08:00"
"Jacky Cheng","General Manager, Greater China","Advantage Plus","Accor","Hotel & Casino","133 Wai Yip Street, 9/F, Kwun Tong, Kowloon","Hong Kong","Hong Kong","HK","+85239625115","+8613917094303","+85227004300","jacky.cheng@advantageplus.com.au",,"2025-08-29T22:20:39+08:00"
"Jose Marloujoy C. Taboada","Videographer | Photographer",,"Cebu Provincial Tourism Office","Government/Consulate","Cebu Provincial Capitol Building, Escario St., Cebu City 6000","Cebu City","Philippines","PH","+63328882326","+639209520038","+63322535642","marloujoy.tourism@yahoo.com.ph",,"2025-08-29T22:20:39+08:00"
"Christine Toguchi","Managing Director",,"Macrovision Network Pte Ltd","Tech","Rochester Mall, 35 Rochester Drive, #03-01, Singapore 138639","Singapore","Singapore","SG","+6591856168",,,"christine@macrovisionnetwork.com","www.macrovisionnetwork.com","2025-08-29T22:20:39+08:00"
"Jason Chin","Group Director of Revenue",,"Far East Hospitality","Hotel & Casino","1 Tanglin Road, #05-01, Singapore 247905","Singapore","Singapore","SG","+6567358811","+6598582881","+6567350743","jasonchin@concorde.net",,"2025-08-29T22:20:39+08:00"
"Sri Wahidah Masturi","Head of Sales & Marketing",,"Wanderlust Hotel","Hotel & Casino","2 Dickson Road, Singapore 209494","Singapore","Singapore","SG",,"+6593855017","+6563963322","wahidah.masturi@unlistedcollection.com","www.unlistedcollection.com","2025-08-29T22:20:39+08:00"
"Ma. Coche Gamilao","General Manager",,"KPG Travels Tours","Travel Agency","Gorordo Ave, Cebu City","Cebu City","Philippines","PH","+63324120936","+639272535376",,"KPGtravelandtours@gmail.com","www.kpgtravelandtours.com","2025-08-29T22:20:39+08:00"
"Seokho Seo","Assistant Manager","Global Business Dept. Travel Contents Development Group","Rakuten, Inc.","Tech","Rakuten Crimson House, 1-14-1 Tamagawa, Setagaya-ku, Tokyo 158-0094","Tokyo","Japan","JP","+815058175080",,"+818043305357",,"seokho.seo@mail.rakuten.com","http://travel.rakuten.co.jp/","2025-08-29T22:20:39+08:00"
"Jo Ann Castillo","Director of Sales",,"Crimson Resort and Spa Mactan","Hotel & Casino","Seascapes Resort Town, Mactan Island, Cebu 6015","Cebu City","Philippines","PH","+63324019999","+639989616107",,"mactan.dos@crimsonhotel.com","www.crimsonhotel.com","2025-08-29T22:20:39+08:00"
"Jeffrey Tan","Head of Area Indonesia",,"Ryokkan Holdings Pte Ltd","Hotel & Casino","Level 3 to 6, 122 Dunlop Street, Singapore 209440","Singapore","Singapore","SG","+6564298818",,"jeffrey@ryokancollective.com",,"2025-08-29T22:20:39+08:00"
"Ayesha Khanna","CEO",,"Technology Quotient","Tech",,,"Singapore","SG",,"+6591465794",,"ayesha@tech-quotient.com",,"2025-08-29T22:20:39+08:00"
"Masato Ishihara","Global Business Owner",,"IKYU Corporation","Tech","Sumitomo-Fudosan Akasaka Bldg 8F 3-3-3 Akasaka, Minato-ku, Tokyo","Tokyo","Japan","JP","+81362290069",,"+81362348021","ishihara-m@ikyu.com","http://www.ikyu.com/","2025-08-29T22:20:39+08:00"
"Mariah Assunção","Marketing Director",,"eyefortravel","Travel Agency","7-9 Fashion Street, London, E1 6PX, UK","London","United Kingdom","GB","+442073757226",,,"mariah@eyefortravel.com",,"2025-08-29T22:20:39+08:00"
"Yusof Hamzah","Director","Business Strategies","Royale International Group","Consulting","21 Genting Road #04-01, Singapore 349479","Singapore","Singapore","SG","+6567377966","+6596897760","+6567379420","yusof.hamzah@royalsg.com.sg",,"2025-08-29T22:20:39+08:00"
"Luke Tan","Project Manager",,"New-Revolutions Pte Ltd","Tech","126 Joo Seng Road, #05-06, Singapore 368355","Singapore","Singapore","SG",,"+6568168833",,"luke.tan@new-revolutions.com",,"2025-08-29T22:20:39+08:00"
"Hilda Cahyani, Ph.D.","Lecturer",,"State Polytechnic of Malang","Polytechnic","Jl. Soekarno-Hatta No.9, Malang, East Java, Indonesia 65141","Malang","Indonesia","ID",,"+62341404424",,,"+62341404425","hildacahyani@polinema.ac.id",,"2025-08-29T22:20:39+08:00"
"Linus Lim","General Manager",,"New-Revolutions Pte Ltd","Tech","126 Joo Seng Road, #05-06, Singapore 368355","Singapore","Singapore","SG","+6568168833","+6597474142",,"linus.lim@new-revolutions.com",,"2025-08-29T22:20:39+08:00"
"Dr. Zulkifli Habarak Dip.I., M.S., Par","Director",,"Ministry of Tourism - Palembang Polytechnic of Tourism","Polytechnic","Jl. Sumpah Pemuda Blok N, No.2, Kampus, Palembang, 30129","Palembang","Indonesia","ID",,,"+6281322079998",,"zulkifli.habarak@poltekpar-palembang.ac.id",,"2025-08-29T22:20:39+08:00"
"Jerald Teh","Business Development",,"New-Revolutions Pte Ltd","Tech","126 Joo Seng Road, #05-06, Singapore 368355","Singapore","Singapore","SG","+6568118730",,,"jerald.teh@new-revolutions.com",,"2025-08-29T22:20:39+08:00"
